LOCATION,TIMESTAMP,PRODUCT,PRICE,COUNTRY,CURRENCY,USD,STD_TIMESTAMP
OH,08-27-2019 18:39:41,12346,2.99,USA,USD,2.99,2019-08-27T17:39:41+00:00
OH,08-27-2019 19:39:41,12346,2.99,USA,USD,2.99,2019-08-27T18:39:41+00:00
OH,08-27-2019 20:39:41,12346,2.99,USA,USD,2.99,2019-08-27T19:39:41+00:00
OH,08-27-2019 21:39:41,12346,2.99,USA,USD,2.99,2019-08-27T20:39:41+00:00
OH,08-27-2019 22:39:41,12345,9.99,USA,USD,9.99,2019-08-27T21:39:41+00:00
OH,08-27-2019 23:39:41,12345,7.99,USA,USD,7.99,2019-08-27T22:39:41+00:00
OH,08-28-2019 00:39:41,12346,2.99,USA,USD,2.99,2019-08-27T23:39:41+00:00
OH,08-28-2019 01:39:41,12346,2.99,USA,USD,2.99,2019-08-28T00:39:41+00:00
OH,08-28-2019 02:39:41,12346,2.99,USA,USD,2.99,2019-08-28T01:39:41+00:00
OH,08-28-2019 03:39:41,12346,2.99,USA,USD,2.99,2019-08-28T02:39:41+00:00
OH,08-28-2019 04:39:41,12346,2.99,USA,USD,2.99,2019-08-28T03:39:41+00:00
OH,08-28-2019 05:39:41,12346,2.99,USA,USD,2.99,2019-08-28T04:39:41+00:00
OH,08-28-2019 06:39:41,12345,7.99,USA,USD,7.99,2019-08-28T05:39:41+00:00
OH,08-28-2019 07:39:41,12345,9.99,USA,USD,9.99,2019-08-28T06:39:41+00:00
OH,08-28-2019 08:39:41,12346,2.99,USA,USD,2.99,2019-08-28T07:39:41+00:00
OH,08-28-2019 09:39:41,12346,2.99,USA,USD,2.99,2019-08-28T08:39:41+00:00
OH,08-28-2019 10:39:41,12346,2.99,USA,USD,2.99,2019-08-28T09:39:41+00:00
OH,08-28-2019 11:39:41,12345,9.99,USA,USD,9.99,2019-08-28T10:39:41+00:00
OH,08-28-2019 12:39:41,12346,2.99,USA,USD,2.99,2019-08-28T11:39:41+00:00
OH,08-28-2019 13:39:41,12346,2.99,USA,USD,2.99,2019-08-28T12:39:41+00:00
OH,08-28-2019 14:39:41,12346,2.99,USA,USD,2.99,2019-08-28T13:39:41+00:00
OH,08-28-2019 15:39:41,12345,9.99,USA,USD,9.99,2019-08-28T14:39:41+00:00
OH,08-28-2019 16:39:41,12345,9.99,USA,USD,9.99,2019-08-28T15:39:41+00:00
OH,08-28-2019 17:39:41,12346,2.99,USA,USD,2.99,2019-08-28T16:39:41+00:00
OH,08-28-2019 18:39:41,12346,2.99,USA,USD,2.99,2019-08-28T17:39:41+00:00
OH,08-28-2019 19:39:41,12345,7.99,USA,USD,7.99,2019-08-28T18:39:41+00:00
OH,08-28-2019 20:39:41,12346,2.99,USA,USD,2.99,2019-08-28T19:39:41+00:00
OH,08-28-2019 21:39:41,12345,7.99,USA,USD,7.99,2019-08-28T20:39:41+00:00
OH,08-28-2019 22:39:41,12346,2.99,USA,USD,2.99,2019-08-28T21:39:41+00:00
OH,08-28-2019 23:39:41,12346,2.99,USA,USD,2.99,2019-08-28T22:39:41+00:00
OH,08-29-2019 00:39:41,12346,2.99,USA,USD,2.99,2019-08-28T23:39:41+00:00
OH,08-29-2019 01:39:41,12346,2.99,USA,USD,2.99,2019-08-29T00:39:41+00:00
OH,08-29-2019 02:39:41,12345,9.99,USA,USD,9.99,2019-08-29T01:39:41+00:00
OH,08-29-2019 03:39:41,12345,9.99,USA,USD,9.99,2019-08-29T02:39:41+00:00
OH,08-29-2019 04:39:41,12346,2.99,USA,USD,2.99,2019-08-29T03:39:41+00:00
OH,08-29-2019 05:39:41,12346,2.99,USA,USD,2.99,2019-08-29T04:39:41+00:00
OH,08-29-2019 06:39:41,12346,2.99,USA,USD,2.99,2019-08-29T05:39:41+00:00
OH,08-29-2019 07:39:41,12345,7.99,USA,USD,7.99,2019-08-29T06:39:41+00:00
OH,08-29-2019 08:39:41,12345,9.99,USA,USD,9.99,2019-08-29T07:39:41+00:00
OH,08-29-2019 09:39:41,12346,2.99,USA,USD,2.99,2019-08-29T08:39:41+00:00
OH,08-29-2019 10:39:41,12346,2.99,USA,USD,2.99,2019-08-29T09:39:41+00:00
OH,08-29-2019 11:39:41,12346,2.99,USA,USD,2.99,2019-08-29T10:39:41+00:00
OH,08-29-2019 12:39:41,12346,2.99,USA,USD,2.99,2019-08-29T11:39:41+00:00
OH,08-29-2019 13:39:41,12346,2.99,USA,USD,2.99,2019-08-29T12:39:41+00:00
OH,08-29-2019 14:39:41,12345,9.99,USA,USD,9.99,2019-08-29T13:39:41+00:00
OH,08-29-2019 15:39:41,12346,2.99,USA,USD,2.99,2019-08-29T14:39:41+00:00
OH,08-29-2019 16:39:41,12346,2.99,USA,USD,2.99,2019-08-29T15:39:41+00:00
OH,08-29-2019 17:39:41,12346,2.99,USA,USD,2.99,2019-08-29T16:39:41+00:00
OH,08-29-2019 18:39:41,12346,2.99,USA,USD,2.99,2019-08-29T17:39:41+00:00
OH,08-29-2019 19:39:41,12346,2.99,USA,USD,2.99,2019-08-29T18:39:41+00:00
OH,08-29-2019 20:39:41,12346,2.99,USA,USD,2.99,2019-08-29T19:39:41+00:00
OH,08-29-2019 21:39:41,12346,2.99,USA,USD,2.99,2019-08-29T20:39:41+00:00
OH,08-29-2019 22:39:41,12346,2.99,USA,USD,2.99,2019-08-29T21:39:41+00:00
OH,08-29-2019 23:39:41,12346,2.99,USA,USD,2.99,2019-08-29T22:39:41+00:00
OH,08-30-2019 00:39:41,12345,9.99,USA,USD,9.99,2019-08-29T23:39:41+00:00
OH,08-30-2019 01:39:41,12346,2.99,USA,USD,2.99,2019-08-30T00:39:41+00:00
OH,08-30-2019 02:39:41,12345,9.99,USA,USD,9.99,2019-08-30T01:39:41+00:00
OH,08-30-2019 03:39:41,12346,2.99,USA,USD,2.99,2019-08-30T02:39:41+00:00
OH,08-30-2019 04:39:41,12346,2.99,USA,USD,2.99,2019-08-30T03:39:41+00:00
OH,08-30-2019 05:39:41,12346,2.99,USA,USD,2.99,2019-08-30T04:39:41+00:00
OH,08-30-2019 06:39:41,12346,2.99,USA,USD,2.99,2019-08-30T05:39:41+00:00
OH,08-30-2019 07:39:41,12346,2.99,USA,USD,2.99,2019-08-30T06:39:41+00:00
OH,08-30-2019 08:39:41,12346,2.99,USA,USD,2.99,2019-08-30T07:39:41+00:00
OH,08-30-2019 09:39:41,12345,9.99,USA,USD,9.99,2019-08-30T08:39:41+00:00
OH,08-30-2019 10:39:41,12346,2.99,USA,USD,2.99,2019-08-30T09:39:41+00:00
OH,08-30-2019 11:39:41,12346,2.99,USA,USD,2.99,2019-08-30T10:39:41+00:00
OH,08-30-2019 12:39:41,12346,2.99,USA,USD,2.99,2019-08-30T11:39:41+00:00
OH,08-30-2019 13:39:41,12345,9.99,USA,USD,9.99,2019-08-30T12:39:41+00:00
OH,08-30-2019 14:39:41,12345,9.99,USA,USD,9.99,2019-08-30T13:39:41+00:00
OH,08-30-2019 15:39:41,12346,2.99,USA,USD,2.99,2019-08-30T14:39:41+00:00
OH,08-30-2019 16:39:41,12345,9.99,USA,USD,9.99,2019-08-30T15:39:41+00:00
OH,08-30-2019 17:39:41,12346,2.99,USA,USD,2.99,2019-08-30T16:39:41+00:00
OH,08-30-2019 18:39:41,12346,2.99,USA,USD,2.99,2019-08-30T17:39:41+00:00
OH,08-30-2019 19:39:41,12346,2.99,USA,USD,2.99,2019-08-30T18:39:41+00:00
OH,08-30-2019 20:39:41,12345,9.99,USA,USD,9.99,2019-08-30T19:39:41+00:00
OH,08-30-2019 21:39:41,12346,2.99,USA,USD,2.99,2019-08-30T20:39:41+00:00
OH,08-30-2019 22:39:41,12346,2.99,USA,USD,2.99,2019-08-30T21:39:41+00:00
OH,08-30-2019 23:39:41,12346,2.99,USA,USD,2.99,2019-08-30T22:39:41+00:00
OH,08-31-2019 00:39:41,12346,2.99,USA,USD,2.99,2019-08-30T23:39:41+00:00
OH,08-31-2019 01:39:41,12345,9.99,USA,USD,9.99,2019-08-31T00:39:41+00:00
OH,08-31-2019 02:39:41,12346,2.99,USA,USD,2.99,2019-08-31T01:39:41+00:00
OH,08-31-2019 03:39:41,12346,2.99,USA,USD,2.99,2019-08-31T02:39:41+00:00
OH,08-31-2019 04:39:41,12345,9.99,USA,USD,9.99,2019-08-31T03:39:41+00:00
OH,08-31-2019 05:39:41,12346,2.99,USA,USD,2.99,2019-08-31T04:39:41+00:00
OH,08-31-2019 06:39:41,12346,2.99,USA,USD,2.99,2019-08-31T05:39:41+00:00
OH,08-31-2019 07:39:41,12345,9.99,USA,USD,9.99,2019-08-31T06:39:41+00:00
OH,08-31-2019 08:39:41,12346,2.99,USA,USD,2.99,2019-08-31T07:39:41+00:00
OH,08-31-2019 09:39:41,12345,7.99,USA,USD,7.99,2019-08-31T08:39:41+00:00
OH,08-31-2019 10:39:41,12345,7.99,USA,USD,7.99,2019-08-31T09:39:41+00:00
OH,08-31-2019 11:39:41,12345,9.99,USA,USD,9.99,2019-08-31T10:39:41+00:00
OH,08-31-2019 12:39:41,12346,2.99,USA,USD,2.99,2019-08-31T11:39:41+00:00
OH,08-31-2019 13:39:41,12346,2.99,USA,USD,2.99,2019-08-31T12:39:41+00:00
OH,08-31-2019 14:39:41,12346,2.99,USA,USD,2.99,2019-08-31T13:39:41+00:00
OH,08-31-2019 15:39:41,12346,2.99,USA,USD,2.99,2019-08-31T14:39:41+00:00
OH,08-31-2019 16:39:41,12346,2.99,USA,USD,2.99,2019-08-31T15:39:41+00:00
OH,08-31-2019 17:39:41,12346,2.99,USA,USD,2.99,2019-08-31T16:39:41+00:00
OH,08-31-2019 18:39:41,12346,2.99,USA,USD,2.99,2019-08-31T17:39:41+00:00
OH,08-31-2019 19:39:41,12346,2.99,USA,USD,2.99,2019-08-31T18:39:41+00:00
OH,08-31-2019 20:39:41,12346,2.99,USA,USD,2.99,2019-08-31T19:39:41+00:00
OH,08-31-2019 21:39:41,12345,7.99,USA,USD,7.99,2019-08-31T20:39:41+00:00
OH,08-31-2019 22:39:41,12345,9.99,USA,USD,9.99,2019-08-31T21:39:41+00:00
OH,08-31-2019 23:39:41,12345,9.99,USA,USD,9.99,2019-08-31T22:39:41+00:00
OH,09-01-2019 00:39:41,12345,9.99,USA,USD,9.99,2019-08-31T23:39:41+00:00
OH,09-01-2019 01:39:41,12346,2.99,USA,USD,2.99,2019-09-01T00:39:41+00:00
OH,09-01-2019 02:39:41,12346,2.99,USA,USD,2.99,2019-09-01T01:39:41+00:00
OH,09-01-2019 03:39:41,12346,2.99,USA,USD,2.99,2019-09-01T02:39:41+00:00
OH,09-01-2019 04:39:41,12346,2.99,USA,USD,2.99,2019-09-01T03:39:41+00:00
OH,09-01-2019 05:39:41,12346,2.99,USA,USD,2.99,2019-09-01T04:39:41+00:00
OH,09-01-2019 06:39:41,12346,2.99,USA,USD,2.99,2019-09-01T05:39:41+00:00
OH,09-01-2019 07:39:41,12346,2.99,USA,USD,2.99,2019-09-01T06:39:41+00:00
OH,09-01-2019 08:39:41,12345,7.99,USA,USD,7.99,2019-09-01T07:39:41+00:00
OH,09-01-2019 09:39:41,12346,2.99,USA,USD,2.99,2019-09-01T08:39:41+00:00
OH,09-01-2019 10:39:41,12346,2.99,USA,USD,2.99,2019-09-01T09:39:41+00:00
OH,09-01-2019 11:39:41,12345,9.99,USA,USD,9.99,2019-09-01T10:39:41+00:00
OH,09-01-2019 12:39:41,12346,2.99,USA,USD,2.99,2019-09-01T11:39:41+00:00
OH,09-01-2019 13:39:41,12345,9.99,USA,USD,9.99,2019-09-01T12:39:41+00:00
OH,09-01-2019 14:39:41,12345,7.99,USA,USD,7.99,2019-09-01T13:39:41+00:00
OH,09-01-2019 15:39:41,12346,2.99,USA,USD,2.99,2019-09-01T14:39:41+00:00
OH,09-01-2019 16:39:41,12345,9.99,USA,USD,9.99,2019-09-01T15:39:41+00:00
OH,09-01-2019 17:39:41,12346,2.99,USA,USD,2.99,2019-09-01T16:39:41+00:00
OH,09-01-2019 18:39:41,12345,7.99,USA,USD,7.99,2019-09-01T17:39:41+00:00
OH,09-01-2019 19:39:41,12346,2.99,USA,USD,2.99,2019-09-01T18:39:41+00:00
OH,09-01-2019 20:39:41,12346,2.99,USA,USD,2.99,2019-09-01T19:39:41+00:00
OH,09-01-2019 21:39:41,12346,2.99,USA,USD,2.99,2019-09-01T20:39:41+00:00
OH,09-01-2019 22:39:41,12346,2.99,USA,USD,2.99,2019-09-01T21:39:41+00:00
OH,09-01-2019 23:39:41,12346,2.99,USA,USD,2.99,2019-09-01T22:39:41+00:00
OH,09-02-2019 00:39:41,12345,7.99,USA,USD,7.99,2019-09-01T23:39:41+00:00
OH,09-02-2019 01:39:41,12346,2.99,USA,USD,2.99,2019-09-02T00:39:41+00:00
OH,09-02-2019 02:39:41,12345,7.99,USA,USD,7.99,2019-09-02T01:39:41+00:00
OH,09-02-2019 03:39:41,12346,2.99,USA,USD,2.99,2019-09-02T02:39:41+00:00
OH,09-02-2019 04:39:41,12345,9.99,USA,USD,9.99,2019-09-02T03:39:41+00:00
OH,09-02-2019 05:39:41,12345,7.99,USA,USD,7.99,2019-09-02T04:39:41+00:00
OH,09-02-2019 06:39:41,12346,2.99,USA,USD,2.99,2019-09-02T05:39:41+00:00
OH,09-02-2019 07:39:41,12346,2.99,USA,USD,2.99,2019-09-02T06:39:41+00:00
OH,09-02-2019 08:39:41,12345,9.99,USA,USD,9.99,2019-09-02T07:39:41+00:00
OH,09-02-2019 09:39:41,12346,2.99,USA,USD,2.99,2019-09-02T08:39:41+00:00
OH,09-02-2019 10:39:41,12346,2.99,USA,USD,2.99,2019-09-02T09:39:41+00:00
OH,09-02-2019 11:39:41,12346,2.99,USA,USD,2.99,2019-09-02T10:39:41+00:00
OH,09-02-2019 12:39:41,12346,2.99,USA,USD,2.99,2019-09-02T11:39:41+00:00
OH,09-02-2019 13:39:41,12346,2.99,USA,USD,2.99,2019-09-02T12:39:41+00:00
OH,09-02-2019 14:39:41,12345,7.99,USA,USD,7.99,2019-09-02T13:39:41+00:00
OH,09-02-2019 15:39:41,12346,2.99,USA,USD,2.99,2019-09-02T14:39:41+00:00
OH,09-02-2019 16:39:41,12345,9.99,USA,USD,9.99,2019-09-02T15:39:41+00:00
OH,09-02-2019 17:39:41,12346,2.99,USA,USD,2.99,2019-09-02T16:39:41+00:00
OH,09-02-2019 18:39:41,12345,7.99,USA,USD,7.99,2019-09-02T17:39:41+00:00
OH,09-02-2019 19:39:41,12346,2.99,USA,USD,2.99,2019-09-02T18:39:41+00:00
OH,09-02-2019 20:39:41,12346,2.99,USA,USD,2.99,2019-09-02T19:39:41+00:00
OH,09-02-2019 21:39:41,12346,2.99,USA,USD,2.99,2019-09-02T20:39:41+00:00
OH,09-02-2019 22:39:41,12346,2.99,USA,USD,2.99,2019-09-02T21:39:41+00:00
OH,09-02-2019 23:39:41,12345,9.99,USA,USD,9.99,2019-09-02T22:39:41+00:00
OH,09-03-2019 00:39:41,12345,9.99,USA,USD,9.99,2019-09-02T23:39:41+00:00
OH,09-03-2019 01:39:41,12345,9.99,USA,USD,9.99,2019-09-03T00:39:41+00:00
OH,09-03-2019 02:39:41,12345,9.99,USA,USD,9.99,2019-09-03T01:39:41+00:00
OH,09-03-2019 03:39:41,12346,2.99,USA,USD,2.99,2019-09-03T02:39:41+00:00
OH,09-03-2019 04:39:41,12345,7.99,USA,USD,7.99,2019-09-03T03:39:41+00:00
OH,09-03-2019 05:39:41,12345,7.99,USA,USD,7.99,2019-09-03T04:39:41+00:00
OH,09-03-2019 06:39:41,12345,7.99,USA,USD,7.99,2019-09-03T05:39:41+00:00
OH,09-03-2019 07:39:41,12346,2.99,USA,USD,2.99,2019-09-03T06:39:41+00:00
OH,09-03-2019 08:39:41,12346,2.99,USA,USD,2.99,2019-09-03T07:39:41+00:00
OH,09-03-2019 09:39:41,12345,9.99,USA,USD,9.99,2019-09-03T08:39:41+00:00
OH,09-03-2019 10:39:41,12346,2.99,USA,USD,2.99,2019-09-03T09:39:41+00:00
OH,09-03-2019 11:39:41,12346,2.99,USA,USD,2.99,2019-09-03T10:39:41+00:00
OH,09-03-2019 12:39:41,12346,2.99,USA,USD,2.99,2019-09-03T11:39:41+00:00
OH,09-03-2019 13:39:41,12346,2.99,USA,USD,2.99,2019-09-03T12:39:41+00:00
OH,09-03-2019 14:39:41,12346,2.99,USA,USD,2.99,2019-09-03T13:39:41+00:00
OH,09-03-2019 15:39:41,12346,2.99,USA,USD,2.99,2019-09-03T14:39:41+00:00
OH,09-03-2019 16:39:41,12346,2.99,USA,USD,2.99,2019-09-03T15:39:41+00:00
OH,09-03-2019 17:39:41,12346,2.99,USA,USD,2.99,2019-09-03T16:39:41+00:00
OH,09-03-2019 18:39:41,12345,9.99,USA,USD,9.99,2019-09-03T17:39:41+00:00
OH,09-03-2019 19:39:41,12346,2.99,USA,USD,2.99,2019-09-03T18:39:41+00:00
OH,09-03-2019 20:39:41,12346,2.99,USA,USD,2.99,2019-09-03T19:39:41+00:00
OH,09-03-2019 21:39:41,12346,2.99,USA,USD,2.99,2019-09-03T20:39:41+00:00
OH,09-03-2019 22:39:41,12346,2.99,USA,USD,2.99,2019-09-03T21:39:41+00:00
OH,09-03-2019 23:39:41,12346,2.99,USA,USD,2.99,2019-09-03T22:39:41+00:00
OH,09-04-2019 00:39:41,12346,2.99,USA,USD,2.99,2019-09-03T23:39:41+00:00
OH,09-04-2019 01:39:41,12346,2.99,USA,USD,2.99,2019-09-04T00:39:41+00:00
OH,09-04-2019 02:39:41,12345,7.99,USA,USD,7.99,2019-09-04T01:39:41+00:00
OH,09-04-2019 03:39:41,12346,2.99,USA,USD,2.99,2019-09-04T02:39:41+00:00
OH,09-04-2019 04:39:41,12345,7.99,USA,USD,7.99,2019-09-04T03:39:41+00:00
OH,09-04-2019 05:39:41,12345,9.99,USA,USD,9.99,2019-09-04T04:39:41+00:00
OH,09-04-2019 06:39:41,12345,7.99,USA,USD,7.99,2019-09-04T05:39:41+00:00
OH,09-04-2019 07:39:41,12346,2.99,USA,USD,2.99,2019-09-04T06:39:41+00:00
OH,09-04-2019 08:39:41,12346,2.99,USA,USD,2.99,2019-09-04T07:39:41+00:00
OH,09-04-2019 09:39:41,12346,2.99,USA,USD,2.99,2019-09-04T08:39:41+00:00
OH,09-04-2019 10:39:41,12346,2.99,USA,USD,2.99,2019-09-04T09:39:41+00:00
OH,09-04-2019 11:39:41,12345,7.99,USA,USD,7.99,2019-09-04T10:39:41+00:00
OH,09-04-2019 12:39:41,12346,2.99,USA,USD,2.99,2019-09-04T11:39:41+00:00
OH,09-04-2019 13:39:41,12345,9.99,USA,USD,9.99,2019-09-04T12:39:41+00:00
OH,09-04-2019 14:39:41,12345,7.99,USA,USD,7.99,2019-09-04T13:39:41+00:00
OH,09-04-2019 15:39:41,12346,2.99,USA,USD,2.99,2019-09-04T14:39:41+00:00
OH,09-04-2019 16:39:41,12346,2.99,USA,USD,2.99,2019-09-04T15:39:41+00:00
OH,09-04-2019 17:39:41,12345,7.99,USA,USD,7.99,2019-09-04T16:39:41+00:00
OH,09-04-2019 18:39:41,12346,2.99,USA,USD,2.99,2019-09-04T17:39:41+00:00
OH,09-04-2019 19:39:41,12346,2.99,USA,USD,2.99,2019-09-04T18:39:41+00:00
OH,09-04-2019 20:39:41,12346,2.99,USA,USD,2.99,2019-09-04T19:39:41+00:00
OH,09-04-2019 21:39:41,12346,2.99,USA,USD,2.99,2019-09-04T20:39:41+00:00
OH,09-04-2019 22:39:41,12346,2.99,USA,USD,2.99,2019-09-04T21:39:41+00:00
OH,09-04-2019 23:39:41,12346,2.99,USA,USD,2.99,2019-09-04T22:39:41+00:00
OH,09-05-2019 00:39:41,12346,2.99,USA,USD,2.99,2019-09-04T23:39:41+00:00
OH,09-05-2019 01:39:41,12345,7.99,USA,USD,7.99,2019-09-05T00:39:41+00:00
OH,09-05-2019 02:39:41,12346,2.99,USA,USD,2.99,2019-09-05T01:39:41+00:00
OH,09-05-2019 03:39:41,12346,2.99,USA,USD,2.99,2019-09-05T02:39:41+00:00
OH,09-05-2019 04:39:41,12345,7.99,USA,USD,7.99,2019-09-05T03:39:41+00:00
OH,09-05-2019 05:39:41,12346,2.99,USA,USD,2.99,2019-09-05T04:39:41+00:00
OH,09-05-2019 06:39:41,12346,2.99,USA,USD,2.99,2019-09-05T05:39:41+00:00
OH,09-05-2019 07:39:41,12346,2.99,USA,USD,2.99,2019-09-05T06:39:41+00:00
OH,09-05-2019 08:39:41,12346,2.99,USA,USD,2.99,2019-09-05T07:39:41+00:00
OH,09-05-2019 09:39:41,12346,2.99,USA,USD,2.99,2019-09-05T08:39:41+00:00
OH,09-05-2019 10:39:41,12345,7.99,USA,USD,7.99,2019-09-05T09:39:41+00:00
OH,09-05-2019 11:39:41,12346,2.99,USA,USD,2.99,2019-09-05T10:39:41+00:00
OH,09-05-2019 12:39:41,12346,2.99,USA,USD,2.99,2019-09-05T11:39:41+00:00
OH,09-05-2019 13:39:41,12346,2.99,USA,USD,2.99,2019-09-05T12:39:41+00:00
OH,09-05-2019 14:39:41,12346,2.99,USA,USD,2.99,2019-09-05T13:39:41+00:00
OH,09-05-2019 15:39:41,12345,9.99,USA,USD,9.99,2019-09-05T14:39:41+00:00
OH,09-05-2019 16:39:41,12346,2.99,USA,USD,2.99,2019-09-05T15:39:41+00:00
OH,09-05-2019 17:39:41,12346,2.99,USA,USD,2.99,2019-09-05T16:39:41+00:00
OH,09-05-2019 18:39:41,12345,9.99,USA,USD,9.99,2019-09-05T17:39:41+00:00
OH,09-05-2019 19:39:41,12346,2.99,USA,USD,2.99,2019-09-05T18:39:41+00:00
OH,09-05-2019 20:39:41,12346,2.99,USA,USD,2.99,2019-09-05T19:39:41+00:00
OH,09-05-2019 21:39:41,12346,2.99,USA,USD,2.99,2019-09-05T20:39:41+00:00
OH,09-05-2019 22:39:41,12346,2.99,USA,USD,2.99,2019-09-05T21:39:41+00:00
OH,09-05-2019 23:39:41,12346,2.99,USA,USD,2.99,2019-09-05T22:39:41+00:00
OH,09-06-2019 00:39:41,12346,2.99,USA,USD,2.99,2019-09-05T23:39:41+00:00
OH,09-06-2019 01:39:41,12346,2.99,USA,USD,2.99,2019-09-06T00:39:41+00:00
OH,09-06-2019 02:39:41,12345,7.99,USA,USD,7.99,2019-09-06T01:39:41+00:00
OH,09-06-2019 03:39:41,12346,2.99,USA,USD,2.99,2019-09-06T02:39:41+00:00
OH,09-06-2019 04:39:41,12346,2.99,USA,USD,2.99,2019-09-06T03:39:41+00:00
OH,09-06-2019 05:39:41,12346,2.99,USA,USD,2.99,2019-09-06T04:39:41+00:00
OH,09-06-2019 06:39:41,12345,9.99,USA,USD,9.99,2019-09-06T05:39:41+00:00
OH,09-06-2019 07:39:41,12345,7.99,USA,USD,7.99,2019-09-06T06:39:41+00:00
OH,09-06-2019 08:39:41,12346,2.99,USA,USD,2.99,2019-09-06T07:39:41+00:00
OH,09-06-2019 09:39:41,12346,2.99,USA,USD,2.99,2019-09-06T08:39:41+00:00
OH,09-06-2019 10:39:41,12345,7.99,USA,USD,7.99,2019-09-06T09:39:41+00:00
OH,09-06-2019 11:39:41,12346,2.99,USA,USD,2.99,2019-09-06T10:39:41+00:00
OH,09-06-2019 12:39:41,12345,9.99,USA,USD,9.99,2019-09-06T11:39:41+00:00
OH,09-06-2019 13:39:41,12346,2.99,USA,USD,2.99,2019-09-06T12:39:41+00:00
OH,09-06-2019 14:39:41,12345,7.99,USA,USD,7.99,2019-09-06T13:39:41+00:00
OH,09-06-2019 15:39:41,12346,2.99,USA,USD,2.99,2019-09-06T14:39:41+00:00
OH,09-06-2019 16:39:41,12346,2.99,USA,USD,2.99,2019-09-06T15:39:41+00:00
OH,09-06-2019 17:39:41,12346,2.99,USA,USD,2.99,2019-09-06T16:39:41+00:00
OH,09-06-2019 18:39:41,12345,9.99,USA,USD,9.99,2019-09-06T17:39:41+00:00
OH,09-06-2019 19:39:41,12346,2.99,USA,USD,2.99,2019-09-06T18:39:41+00:00
OH,09-06-2019 20:39:41,12346,2.99,USA,USD,2.99,2019-09-06T19:39:41+00:00
OH,09-06-2019 21:39:41,12346,2.99,USA,USD,2.99,2019-09-06T20:39:41+00:00
OH,09-06-2019 22:39:41,12345,9.99,USA,USD,9.99,2019-09-06T21:39:41+00:00
OH,09-06-2019 23:39:41,12346,2.99,USA,USD,2.99,2019-09-06T22:39:41+00:00
OH,09-07-2019 00:39:41,12346,2.99,USA,USD,2.99,2019-09-06T23:39:41+00:00
OH,09-07-2019 01:39:41,12346,2.99,USA,USD,2.99,2019-09-07T00:39:41+00:00
OH,09-07-2019 02:39:41,12346,2.99,USA,USD,2.99,2019-09-07T01:39:41+00:00
OH,09-07-2019 03:39:41,12346,2.99,USA,USD,2.99,2019-09-07T02:39:41+00:00
OH,09-07-2019 04:39:41,12345,7.99,USA,USD,7.99,2019-09-07T03:39:41+00:00
OH,09-07-2019 05:39:41,12346,2.99,USA,USD,2.99,2019-09-07T04:39:41+00:00
OH,09-07-2019 06:39:41,12346,2.99,USA,USD,2.99,2019-09-07T05:39:41+00:00
OH,09-07-2019 07:39:41,12345,7.99,USA,USD,7.99,2019-09-07T06:39:41+00:00
OH,09-07-2019 08:39:41,12346,2.99,USA,USD,2.99,2019-09-07T07:39:41+00:00
OH,09-07-2019 09:39:41,12346,2.99,USA,USD,2.99,2019-09-07T08:39:41+00:00
OH,09-07-2019 10:39:41,12346,2.99,USA,USD,2.99,2019-09-07T09:39:41+00:00
OH,09-07-2019 11:39:41,12346,2.99,USA,USD,2.99,2019-09-07T10:39:41+00:00
OH,09-07-2019 12:39:41,12345,9.99,USA,USD,9.99,2019-09-07T11:39:41+00:00
OH,09-07-2019 13:39:41,12345,9.99,USA,USD,9.99,2019-09-07T12:39:41+00:00
OH,09-07-2019 14:39:41,12346,2.99,USA,USD,2.99,2019-09-07T13:39:41+00:00
OH,09-07-2019 15:39:41,12346,2.99,USA,USD,2.99,2019-09-07T14:39:41+00:00
OH,09-07-2019 16:39:41,12346,2.99,USA,USD,2.99,2019-09-07T15:39:41+00:00
OH,09-07-2019 17:39:41,12345,7.99,USA,USD,7.99,2019-09-07T16:39:41+00:00
OH,09-07-2019 18:39:41,12346,2.99,USA,USD,2.99,2019-09-07T17:39:41+00:00
OH,09-07-2019 19:39:41,12345,7.99,USA,USD,7.99,2019-09-07T18:39:41+00:00
OH,09-07-2019 20:39:41,12346,2.99,USA,USD,2.99,2019-09-07T19:39:41+00:00
OH,09-07-2019 21:39:41,12346,2.99,USA,USD,2.99,2019-09-07T20:39:41+00:00
OH,09-07-2019 22:39:41,12345,9.99,USA,USD,9.99,2019-09-07T21:39:41+00:00
OH,09-07-2019 23:39:41,12346,2.99,USA,USD,2.99,2019-09-07T22:39:41+00:00
OH,09-08-2019 00:39:41,12346,2.99,USA,USD,2.99,2019-09-07T23:39:41+00:00
OH,09-08-2019 01:39:41,12346,2.99,USA,USD,2.99,2019-09-08T00:39:41+00:00
OH,09-08-2019 02:39:41,12346,2.99,USA,USD,2.99,2019-09-08T01:39:41+00:00
OH,09-08-2019 03:39:41,12346,2.99,USA,USD,2.99,2019-09-08T02:39:41+00:00
OH,09-08-2019 04:39:41,12345,9.99,USA,USD,9.99,2019-09-08T03:39:41+00:00
OH,09-08-2019 05:39:41,12346,2.99,USA,USD,2.99,2019-09-08T04:39:41+00:00
OH,09-08-2019 06:39:41,12346,2.99,USA,USD,2.99,2019-09-08T05:39:41+00:00
OH,09-08-2019 07:39:41,12346,2.99,USA,USD,2.99,2019-09-08T06:39:41+00:00
OH,09-08-2019 08:39:41,12346,2.99,USA,USD,2.99,2019-09-08T07:39:41+00:00
OH,09-08-2019 09:39:41,12346,2.99,USA,USD,2.99,2019-09-08T08:39:41+00:00
OH,09-08-2019 10:39:41,12345,7.99,USA,USD,7.99,2019-09-08T09:39:41+00:00
OH,09-08-2019 11:39:41,12346,2.99,USA,USD,2.99,2019-09-08T10:39:41+00:00
OH,09-08-2019 12:39:41,12346,2.99,USA,USD,2.99,2019-09-08T11:39:41+00:00
OH,09-08-2019 13:39:41,12346,2.99,USA,USD,2.99,2019-09-08T12:39:41+00:00
OH,09-08-2019 14:39:41,12346,2.99,USA,USD,2.99,2019-09-08T13:39:41+00:00
OH,09-08-2019 15:39:41,12345,9.99,USA,USD,9.99,2019-09-08T14:39:41+00:00
OH,09-08-2019 16:39:41,12346,2.99,USA,USD,2.99,2019-09-08T15:39:41+00:00
OH,09-08-2019 17:39:41,12346,2.99,USA,USD,2.99,2019-09-08T16:39:41+00:00
OH,09-08-2019 18:39:41,12346,2.99,USA,USD,2.99,2019-09-08T17:39:41+00:00
OH,09-08-2019 19:39:41,12346,2.99,USA,USD,2.99,2019-09-08T18:39:41+00:00
OH,09-08-2019 20:39:41,12346,2.99,USA,USD,2.99,2019-09-08T19:39:41+00:00
OH,09-08-2019 21:39:41,12345,9.99,USA,USD,9.99,2019-09-08T20:39:41+00:00
OH,09-08-2019 22:39:41,12346,2.99,USA,USD,2.99,2019-09-08T21:39:41+00:00
OH,09-08-2019 23:39:41,12346,2.99,USA,USD,2.99,2019-09-08T22:39:41+00:00
OH,09-09-2019 00:39:41,12346,2.99,USA,USD,2.99,2019-09-08T23:39:41+00:00
OH,09-09-2019 01:39:41,12345,9.99,USA,USD,9.99,2019-09-09T00:39:41+00:00
OH,09-09-2019 02:39:41,12345,7.99,USA,USD,7.99,2019-09-09T01:39:41+00:00
OH,09-09-2019 03:39:41,12345,9.99,USA,USD,9.99,2019-09-09T02:39:41+00:00
OH,09-09-2019 04:39:41,12346,2.99,USA,USD,2.99,2019-09-09T03:39:41+00:00
OH,09-09-2019 05:39:41,12346,2.99,USA,USD,2.99,2019-09-09T04:39:41+00:00
OH,09-09-2019 06:39:41,12346,2.99,USA,USD,2.99,2019-09-09T05:39:41+00:00
OH,09-09-2019 07:39:41,12346,2.99,USA,USD,2.99,2019-09-09T06:39:41+00:00
OH,09-09-2019 08:39:41,12346,2.99,USA,USD,2.99,2019-09-09T07:39:41+00:00
OH,09-09-2019 09:39:41,12346,2.99,USA,USD,2.99,2019-09-09T08:39:41+00:00
OH,09-09-2019 10:39:41,12346,2.99,USA,USD,2.99,2019-09-09T09:39:41+00:00
OH,09-09-2019 11:39:41,12346,2.99,USA,USD,2.99,2019-09-09T10:39:41+00:00
OH,09-09-2019 12:39:41,12346,2.99,USA,USD,2.99,2019-09-09T11:39:41+00:00
OH,09-09-2019 13:39:41,12346,2.99,USA,USD,2.99,2019-09-09T12:39:41+00:00
OH,09-09-2019 14:39:41,12346,2.99,USA,USD,2.99,2019-09-09T13:39:41+00:00
OH,09-09-2019 15:39:41,12346,2.99,USA,USD,2.99,2019-09-09T14:39:41+00:00
OH,09-09-2019 16:39:41,12346,2.99,USA,USD,2.99,2019-09-09T15:39:41+00:00
OH,09-09-2019 17:39:41,12346,2.99,USA,USD,2.99,2019-09-09T16:39:41+00:00
OH,09-09-2019 18:39:41,12345,7.99,USA,USD,7.99,2019-09-09T17:39:41+00:00
OH,09-09-2019 19:39:41,12346,2.99,USA,USD,2.99,2019-09-09T18:39:41+00:00
OH,09-09-2019 20:39:41,12345,9.99,USA,USD,9.99,2019-09-09T19:39:41+00:00
OH,09-09-2019 21:39:41,12346,2.99,USA,USD,2.99,2019-09-09T20:39:41+00:00
OH,09-09-2019 22:39:41,12346,2.99,USA,USD,2.99,2019-09-09T21:39:41+00:00
OH,09-09-2019 23:39:41,12346,2.99,USA,USD,2.99,2019-09-09T22:39:41+00:00
OH,09-10-2019 00:39:41,12346,2.99,USA,USD,2.99,2019-09-09T23:39:41+00:00
OH,09-10-2019 01:39:41,12346,2.99,USA,USD,2.99,2019-09-10T00:39:41+00:00
OH,09-10-2019 02:39:41,12346,2.99,USA,USD,2.99,2019-09-10T01:39:41+00:00
OH,09-10-2019 03:39:41,12345,9.99,USA,USD,9.99,2019-09-10T02:39:41+00:00
OH,09-10-2019 04:39:41,12346,2.99,USA,USD,2.99,2019-09-10T03:39:41+00:00
OH,09-10-2019 05:39:41,12346,2.99,USA,USD,2.99,2019-09-10T04:39:41+00:00
OH,09-10-2019 06:39:41,12346,2.99,USA,USD,2.99,2019-09-10T05:39:41+00:00
OH,09-10-2019 07:39:41,12345,9.99,USA,USD,9.99,2019-09-10T06:39:41+00:00
OH,09-10-2019 08:39:41,12346,2.99,USA,USD,2.99,2019-09-10T07:39:41+00:00
OH,09-10-2019 09:39:41,12346,2.99,USA,USD,2.99,2019-09-10T08:39:41+00:00
OH,09-10-2019 10:39:41,12345,9.99,USA,USD,9.99,2019-09-10T09:39:41+00:00
OH,09-10-2019 11:39:41,12345,9.99,USA,USD,9.99,2019-09-10T10:39:41+00:00
OH,09-10-2019 12:39:41,12346,2.99,USA,USD,2.99,2019-09-10T11:39:41+00:00
OH,09-10-2019 13:39:41,12346,2.99,USA,USD,2.99,2019-09-10T12:39:41+00:00
OH,09-10-2019 14:39:41,12346,2.99,USA,USD,2.99,2019-09-10T13:39:41+00:00
OH,09-10-2019 15:39:41,12346,2.99,USA,USD,2.99,2019-09-10T14:39:41+00:00
OH,09-10-2019 16:39:41,12346,2.99,USA,USD,2.99,2019-09-10T15:39:41+00:00
OH,09-10-2019 17:39:41,12346,2.99,USA,USD,2.99,2019-09-10T16:39:41+00:00
OH,09-10-2019 18:39:41,12345,7.99,USA,USD,7.99,2019-09-10T17:39:41+00:00
OH,09-10-2019 19:39:41,12346,2.99,USA,USD,2.99,2019-09-10T18:39:41+00:00
OH,09-10-2019 20:39:41,12346,2.99,USA,USD,2.99,2019-09-10T19:39:41+00:00
OH,09-10-2019 21:39:41,12346,2.99,USA,USD,2.99,2019-09-10T20:39:41+00:00
OH,09-10-2019 22:39:41,12346,2.99,USA,USD,2.99,2019-09-10T21:39:41+00:00
OH,09-10-2019 23:39:41,12346,2.99,USA,USD,2.99,2019-09-10T22:39:41+00:00
OH,09-11-2019 00:39:41,12345,9.99,USA,USD,9.99,2019-09-10T23:39:41+00:00
OH,09-11-2019 01:39:41,12346,2.99,USA,USD,2.99,2019-09-11T00:39:41+00:00
OH,09-11-2019 02:39:41,12346,2.99,USA,USD,2.99,2019-09-11T01:39:41+00:00
OH,09-11-2019 03:39:41,12346,2.99,USA,USD,2.99,2019-09-11T02:39:41+00:00
OH,09-11-2019 04:39:41,12346,2.99,USA,USD,2.99,2019-09-11T03:39:41+00:00
OH,09-11-2019 05:39:41,12346,2.99,USA,USD,2.99,2019-09-11T04:39:41+00:00
OH,09-11-2019 06:39:41,12346,2.99,USA,USD,2.99,2019-09-11T05:39:41+00:00
OH,09-11-2019 07:39:41,12345,7.99,USA,USD,7.99,2019-09-11T06:39:41+00:00
OH,09-11-2019 08:39:41,12346,2.99,USA,USD,2.99,2019-09-11T07:39:41+00:00
OH,09-11-2019 09:39:41,12346,2.99,USA,USD,2.99,2019-09-11T08:39:41+00:00
OH,09-11-2019 10:39:41,12345,9.99,USA,USD,9.99,2019-09-11T09:39:41+00:00
OH,09-11-2019 11:39:41,12346,2.99,USA,USD,2.99,2019-09-11T10:39:41+00:00
OH,09-11-2019 12:39:41,12346,2.99,USA,USD,2.99,2019-09-11T11:39:41+00:00
OH,09-11-2019 13:39:41,12346,2.99,USA,USD,2.99,2019-09-11T12:39:41+00:00
OH,09-11-2019 14:39:41,12346,2.99,USA,USD,2.99,2019-09-11T13:39:41+00:00
OH,09-11-2019 15:39:41,12345,7.99,USA,USD,7.99,2019-09-11T14:39:41+00:00
OH,09-11-2019 16:39:41,12346,2.99,USA,USD,2.99,2019-09-11T15:39:41+00:00
OH,09-11-2019 17:39:41,12346,2.99,USA,USD,2.99,2019-09-11T16:39:41+00:00
OH,09-11-2019 18:39:41,12345,9.99,USA,USD,9.99,2019-09-11T17:39:41+00:00
OH,09-11-2019 19:39:41,12345,7.99,USA,USD,7.99,2019-09-11T18:39:41+00:00
OH,09-11-2019 20:39:41,12345,9.99,USA,USD,9.99,2019-09-11T19:39:41+00:00
OH,09-11-2019 21:39:41,12346,2.99,USA,USD,2.99,2019-09-11T20:39:41+00:00
OH,09-11-2019 22:39:41,12346,2.99,USA,USD,2.99,2019-09-11T21:39:41+00:00
OH,09-11-2019 23:39:41,12346,2.99,USA,USD,2.99,2019-09-11T22:39:41+00:00
OH,09-12-2019 00:39:41,12346,2.99,USA,USD,2.99,2019-09-11T23:39:41+00:00
OH,09-12-2019 01:39:41,12346,2.99,USA,USD,2.99,2019-09-12T00:39:41+00:00
OH,09-12-2019 02:39:41,12346,2.99,USA,USD,2.99,2019-09-12T01:39:41+00:00
OH,09-12-2019 03:39:41,12346,2.99,USA,USD,2.99,2019-09-12T02:39:41+00:00
OH,09-12-2019 04:39:41,12346,2.99,USA,USD,2.99,2019-09-12T03:39:41+00:00
OH,09-12-2019 05:39:41,12346,2.99,USA,USD,2.99,2019-09-12T04:39:41+00:00
OH,09-12-2019 06:39:41,12346,2.99,USA,USD,2.99,2019-09-12T05:39:41+00:00
OH,09-12-2019 07:39:41,12345,7.99,USA,USD,7.99,2019-09-12T06:39:41+00:00
OH,09-12-2019 08:39:41,12346,2.99,USA,USD,2.99,2019-09-12T07:39:41+00:00
OH,09-12-2019 09:39:41,12346,2.99,USA,USD,2.99,2019-09-12T08:39:41+00:00
OH,09-12-2019 10:39:41,12345,9.99,USA,USD,9.99,2019-09-12T09:39:41+00:00
OH,09-12-2019 11:39:41,12345,7.99,USA,USD,7.99,2019-09-12T10:39:41+00:00
OH,09-12-2019 12:39:41,12345,7.99,USA,USD,7.99,2019-09-12T11:39:41+00:00
OH,09-12-2019 13:39:41,12346,2.99,USA,USD,2.99,2019-09-12T12:39:41+00:00
OH,09-12-2019 14:39:41,12346,2.99,USA,USD,2.99,2019-09-12T13:39:41+00:00
OH,09-12-2019 15:39:41,12346,2.99,USA,USD,2.99,2019-09-12T14:39:41+00:00
OH,09-12-2019 16:39:41,12346,2.99,USA,USD,2.99,2019-09-12T15:39:41+00:00
OH,09-12-2019 17:39:41,12346,2.99,USA,USD,2.99,2019-09-12T16:39:41+00:00
OH,09-12-2019 18:39:41,12346,2.99,USA,USD,2.99,2019-09-12T17:39:41+00:00
OH,09-12-2019 19:39:41,12346,2.99,USA,USD,2.99,2019-09-12T18:39:41+00:00
OH,09-12-2019 20:39:41,12345,7.99,USA,USD,7.99,2019-09-12T19:39:41+00:00
OH,09-12-2019 21:39:41,12345,9.99,USA,USD,9.99,2019-09-12T20:39:41+00:00
OH,09-12-2019 22:39:41,12346,2.99,USA,USD,2.99,2019-09-12T21:39:41+00:00
OH,09-12-2019 23:39:41,12346,2.99,USA,USD,2.99,2019-09-12T22:39:41+00:00
OH,09-13-2019 00:39:41,12346,2.99,USA,USD,2.99,2019-09-12T23:39:41+00:00
OH,09-13-2019 01:39:41,12346,2.99,USA,USD,2.99,2019-09-13T00:39:41+00:00
OH,09-13-2019 02:39:41,12345,7.99,USA,USD,7.99,2019-09-13T01:39:41+00:00
OH,09-13-2019 03:39:41,12346,2.99,USA,USD,2.99,2019-09-13T02:39:41+00:00
OH,09-13-2019 04:39:41,12346,2.99,USA,USD,2.99,2019-09-13T03:39:41+00:00
OH,09-13-2019 05:39:41,12346,2.99,USA,USD,2.99,2019-09-13T04:39:41+00:00
OH,09-13-2019 06:39:41,12345,7.99,USA,USD,7.99,2019-09-13T05:39:41+00:00
OH,09-13-2019 07:39:41,12345,9.99,USA,USD,9.99,2019-09-13T06:39:41+00:00
OH,09-13-2019 08:39:41,12346,2.99,USA,USD,2.99,2019-09-13T07:39:41+00:00
OH,09-13-2019 09:39:41,12346,2.99,USA,USD,2.99,2019-09-13T08:39:41+00:00
OH,09-13-2019 10:39:41,12346,2.99,USA,USD,2.99,2019-09-13T09:39:41+00:00
OH,09-13-2019 11:39:41,12346,2.99,USA,USD,2.99,2019-09-13T10:39:41+00:00
OH,09-13-2019 12:39:41,12345,9.99,USA,USD,9.99,2019-09-13T11:39:41+00:00
OH,09-13-2019 13:39:41,12346,2.99,USA,USD,2.99,2019-09-13T12:39:41+00:00
OH,09-13-2019 14:39:41,12346,2.99,USA,USD,2.99,2019-09-13T13:39:41+00:00
OH,09-13-2019 15:39:41,12345,9.99,USA,USD,9.99,2019-09-13T14:39:41+00:00
OH,09-13-2019 16:39:41,12346,2.99,USA,USD,2.99,2019-09-13T15:39:41+00:00
OH,09-13-2019 17:39:41,12345,7.99,USA,USD,7.99,2019-09-13T16:39:41+00:00
OH,09-13-2019 18:39:41,12346,2.99,USA,USD,2.99,2019-09-13T17:39:41+00:00
OH,09-13-2019 19:39:41,12345,9.99,USA,USD,9.99,2019-09-13T18:39:41+00:00
OH,09-13-2019 20:39:41,12346,2.99,USA,USD,2.99,2019-09-13T19:39:41+00:00
OH,09-13-2019 21:39:41,12346,2.99,USA,USD,2.99,2019-09-13T20:39:41+00:00
OH,09-13-2019 22:39:41,12346,2.99,USA,USD,2.99,2019-09-13T21:39:41+00:00
OH,09-13-2019 23:39:41,12346,2.99,USA,USD,2.99,2019-09-13T22:39:41+00:00
OH,09-14-2019 00:39:41,12346,2.99,USA,USD,2.99,2019-09-13T23:39:41+00:00
OH,09-14-2019 01:39:41,12346,2.99,USA,USD,2.99,2019-09-14T00:39:41+00:00
OH,09-14-2019 02:39:41,12346,2.99,USA,USD,2.99,2019-09-14T01:39:41+00:00
OH,09-14-2019 03:39:41,12346,2.99,USA,USD,2.99,2019-09-14T02:39:41+00:00
OH,09-14-2019 04:39:41,12345,9.99,USA,USD,9.99,2019-09-14T03:39:41+00:00
OH,09-14-2019 05:39:41,12346,2.99,USA,USD,2.99,2019-09-14T04:39:41+00:00
OH,09-14-2019 06:39:41,12345,7.99,USA,USD,7.99,2019-09-14T05:39:41+00:00
OH,09-14-2019 07:39:41,12346,2.99,USA,USD,2.99,2019-09-14T06:39:41+00:00
OH,09-14-2019 08:39:41,12346,2.99,USA,USD,2.99,2019-09-14T07:39:41+00:00
OH,09-14-2019 09:39:41,12346,2.99,USA,USD,2.99,2019-09-14T08:39:41+00:00
OH,09-14-2019 10:39:41,12346,2.99,USA,USD,2.99,2019-09-14T09:39:41+00:00
OH,09-14-2019 11:39:41,12346,2.99,USA,USD,2.99,2019-09-14T10:39:41+00:00
OH,09-14-2019 12:39:41,12346,2.99,USA,USD,2.99,2019-09-14T11:39:41+00:00
OH,09-14-2019 13:39:41,12346,2.99,USA,USD,2.99,2019-09-14T12:39:41+00:00
OH,09-14-2019 14:39:41,12346,2.99,USA,USD,2.99,2019-09-14T13:39:41+00:00
OH,09-14-2019 15:39:41,12346,2.99,USA,USD,2.99,2019-09-14T14:39:41+00:00
OH,09-14-2019 16:39:41,12346,2.99,USA,USD,2.99,2019-09-14T15:39:41+00:00
OH,09-14-2019 17:39:41,12346,2.99,USA,USD,2.99,2019-09-14T16:39:41+00:00
OH,09-14-2019 18:39:41,12345,7.99,USA,USD,7.99,2019-09-14T17:39:41+00:00
OH,09-14-2019 19:39:41,12346,2.99,USA,USD,2.99,2019-09-14T18:39:41+00:00
OH,09-14-2019 20:39:41,12346,2.99,USA,USD,2.99,2019-09-14T19:39:41+00:00
OH,09-14-2019 21:39:41,12346,2.99,USA,USD,2.99,2019-09-14T20:39:41+00:00
OH,09-14-2019 22:39:41,12346,2.99,USA,USD,2.99,2019-09-14T21:39:41+00:00
OH,09-14-2019 23:39:41,12346,2.99,USA,USD,2.99,2019-09-14T22:39:41+00:00
OH,09-15-2019 00:39:41,12346,2.99,USA,USD,2.99,2019-09-14T23:39:41+00:00
OH,09-15-2019 01:39:41,12346,2.99,USA,USD,2.99,2019-09-15T00:39:41+00:00
OH,09-15-2019 02:39:41,12345,7.99,USA,USD,7.99,2019-09-15T01:39:41+00:00
OH,09-15-2019 03:39:41,12345,9.99,USA,USD,9.99,2019-09-15T02:39:41+00:00
OH,09-15-2019 04:39:41,12346,2.99,USA,USD,2.99,2019-09-15T03:39:41+00:00
OH,09-15-2019 05:39:41,12346,2.99,USA,USD,2.99,2019-09-15T04:39:41+00:00
OH,09-15-2019 06:39:41,12346,2.99,USA,USD,2.99,2019-09-15T05:39:41+00:00
OH,09-15-2019 07:39:41,12345,7.99,USA,USD,7.99,2019-09-15T06:39:41+00:00
OH,09-15-2019 08:39:41,12346,2.99,USA,USD,2.99,2019-09-15T07:39:41+00:00
OH,09-15-2019 09:39:41,12346,2.99,USA,USD,2.99,2019-09-15T08:39:41+00:00
OH,09-15-2019 10:39:41,12346,2.99,USA,USD,2.99,2019-09-15T09:39:41+00:00
OH,09-15-2019 11:39:41,12346,2.99,USA,USD,2.99,2019-09-15T10:39:41+00:00
OH,09-15-2019 12:39:41,12346,2.99,USA,USD,2.99,2019-09-15T11:39:41+00:00
OH,09-15-2019 13:39:41,12345,9.99,USA,USD,9.99,2019-09-15T12:39:41+00:00
OH,09-15-2019 14:39:41,12346,2.99,USA,USD,2.99,2019-09-15T13:39:41+00:00
OH,09-15-2019 15:39:41,12346,2.99,USA,USD,2.99,2019-09-15T14:39:41+00:00
OH,09-15-2019 16:39:41,12346,2.99,USA,USD,2.99,2019-09-15T15:39:41+00:00
OH,09-15-2019 17:39:41,12345,7.99,USA,USD,7.99,2019-09-15T16:39:41+00:00
OH,09-15-2019 18:39:41,12346,2.99,USA,USD,2.99,2019-09-15T17:39:41+00:00
OH,09-15-2019 19:39:41,12345,7.99,USA,USD,7.99,2019-09-15T18:39:41+00:00
OH,09-15-2019 20:39:41,12345,9.99,USA,USD,9.99,2019-09-15T19:39:41+00:00
OH,09-15-2019 21:39:41,12346,2.99,USA,USD,2.99,2019-09-15T20:39:41+00:00
OH,09-15-2019 22:39:41,12345,9.99,USA,USD,9.99,2019-09-15T21:39:41+00:00
OH,09-15-2019 23:39:41,12346,2.99,USA,USD,2.99,2019-09-15T22:39:41+00:00
OH,09-16-2019 00:39:41,12346,2.99,USA,USD,2.99,2019-09-15T23:39:41+00:00
OH,09-16-2019 01:39:41,12346,2.99,USA,USD,2.99,2019-09-16T00:39:41+00:00
OH,09-16-2019 02:39:41,12346,2.99,USA,USD,2.99,2019-09-16T01:39:41+00:00
OH,09-16-2019 03:39:41,12346,2.99,USA,USD,2.99,2019-09-16T02:39:41+00:00
OH,09-16-2019 04:39:41,12346,2.99,USA,USD,2.99,2019-09-16T03:39:41+00:00
OH,09-16-2019 05:39:41,12345,9.99,USA,USD,9.99,2019-09-16T04:39:41+00:00
OH,09-16-2019 06:39:41,12346,2.99,USA,USD,2.99,2019-09-16T05:39:41+00:00
OH,09-16-2019 07:39:41,12345,9.99,USA,USD,9.99,2019-09-16T06:39:41+00:00
OH,09-16-2019 08:39:41,12345,9.99,USA,USD,9.99,2019-09-16T07:39:41+00:00
OH,09-16-2019 09:39:41,12346,2.99,USA,USD,2.99,2019-09-16T08:39:41+00:00
OH,09-16-2019 10:39:41,12346,2.99,USA,USD,2.99,2019-09-16T09:39:41+00:00
OH,09-16-2019 11:39:41,12345,9.99,USA,USD,9.99,2019-09-16T10:39:41+00:00
OH,09-16-2019 12:39:41,12345,9.99,USA,USD,9.99,2019-09-16T11:39:41+00:00
OH,09-16-2019 13:39:41,12345,7.99,USA,USD,7.99,2019-09-16T12:39:41+00:00
OH,09-16-2019 14:39:41,12346,2.99,USA,USD,2.99,2019-09-16T13:39:41+00:00
OH,09-16-2019 15:39:41,12346,2.99,USA,USD,2.99,2019-09-16T14:39:41+00:00
OH,09-16-2019 16:39:41,12346,2.99,USA,USD,2.99,2019-09-16T15:39:41+00:00
OH,09-16-2019 17:39:41,12345,9.99,USA,USD,9.99,2019-09-16T16:39:41+00:00
OH,09-16-2019 18:39:41,12346,2.99,USA,USD,2.99,2019-09-16T17:39:41+00:00
OH,09-16-2019 19:39:41,12345,9.99,USA,USD,9.99,2019-09-16T18:39:41+00:00
OH,09-16-2019 20:39:41,12345,9.99,USA,USD,9.99,2019-09-16T19:39:41+00:00
OH,09-16-2019 21:39:41,12346,2.99,USA,USD,2.99,2019-09-16T20:39:41+00:00
OH,09-16-2019 22:39:41,12345,9.99,USA,USD,9.99,2019-09-16T21:39:41+00:00
OH,09-16-2019 23:39:41,12346,2.99,USA,USD,2.99,2019-09-16T22:39:41+00:00
OH,09-17-2019 00:39:41,12346,2.99,USA,USD,2.99,2019-09-16T23:39:41+00:00
OH,09-17-2019 01:39:41,12346,2.99,USA,USD,2.99,2019-09-17T00:39:41+00:00
OH,09-17-2019 02:39:41,12346,2.99,USA,USD,2.99,2019-09-17T01:39:41+00:00
OH,09-17-2019 03:39:41,12345,7.99,USA,USD,7.99,2019-09-17T02:39:41+00:00
OH,09-17-2019 04:39:41,12346,2.99,USA,USD,2.99,2019-09-17T03:39:41+00:00
OH,09-17-2019 05:39:41,12346,2.99,USA,USD,2.99,2019-09-17T04:39:41+00:00
OH,09-17-2019 06:39:41,12346,2.99,USA,USD,2.99,2019-09-17T05:39:41+00:00
OH,09-17-2019 07:39:41,12346,2.99,USA,USD,2.99,2019-09-17T06:39:41+00:00
OH,09-17-2019 08:39:41,12346,2.99,USA,USD,2.99,2019-09-17T07:39:41+00:00
OH,09-17-2019 09:39:41,12346,2.99,USA,USD,2.99,2019-09-17T08:39:41+00:00
OH,09-17-2019 10:39:41,12345,7.99,USA,USD,7.99,2019-09-17T09:39:41+00:00
OH,09-17-2019 11:39:41,12346,2.99,USA,USD,2.99,2019-09-17T10:39:41+00:00
OH,09-17-2019 12:39:41,12346,2.99,USA,USD,2.99,2019-09-17T11:39:41+00:00
OH,09-17-2019 13:39:41,12346,2.99,USA,USD,2.99,2019-09-17T12:39:41+00:00
OH,09-17-2019 14:39:41,12345,9.99,USA,USD,9.99,2019-09-17T13:39:41+00:00
OH,09-17-2019 15:39:41,12346,2.99,USA,USD,2.99,2019-09-17T14:39:41+00:00
OH,09-17-2019 16:39:41,12346,2.99,USA,USD,2.99,2019-09-17T15:39:41+00:00
OH,09-17-2019 17:39:41,12346,2.99,USA,USD,2.99,2019-09-17T16:39:41+00:00
OH,09-17-2019 18:39:41,12346,2.99,USA,USD,2.99,2019-09-17T17:39:41+00:00
OH,09-17-2019 19:39:41,12346,2.99,USA,USD,2.99,2019-09-17T18:39:41+00:00
OH,09-17-2019 20:39:41,12345,7.99,USA,USD,7.99,2019-09-17T19:39:41+00:00
OH,09-17-2019 21:39:41,12346,2.99,USA,USD,2.99,2019-09-17T20:39:41+00:00
OH,09-17-2019 22:39:41,12346,2.99,USA,USD,2.99,2019-09-17T21:39:41+00:00
OH,09-17-2019 23:39:41,12345,7.99,USA,USD,7.99,2019-09-17T22:39:41+00:00
OH,09-18-2019 00:39:41,12346,2.99,USA,USD,2.99,2019-09-17T23:39:41+00:00
OH,09-18-2019 01:39:41,12346,2.99,USA,USD,2.99,2019-09-18T00:39:41+00:00
OH,09-18-2019 02:39:41,12345,9.99,USA,USD,9.99,2019-09-18T01:39:41+00:00
OH,09-18-2019 03:39:41,12345,7.99,USA,USD,7.99,2019-09-18T02:39:41+00:00
OH,09-18-2019 04:39:41,12345,9.99,USA,USD,9.99,2019-09-18T03:39:41+00:00
OH,09-18-2019 05:39:41,12346,2.99,USA,USD,2.99,2019-09-18T04:39:41+00:00
OH,09-18-2019 06:39:41,12346,2.99,USA,USD,2.99,2019-09-18T05:39:41+00:00
OH,09-18-2019 07:39:41,12346,2.99,USA,USD,2.99,2019-09-18T06:39:41+00:00
OH,09-18-2019 08:39:41,12345,9.99,USA,USD,9.99,2019-09-18T07:39:41+00:00
OH,09-18-2019 09:39:41,12346,2.99,USA,USD,2.99,2019-09-18T08:39:41+00:00
OH,09-18-2019 10:39:41,12346,2.99,USA,USD,2.99,2019-09-18T09:39:41+00:00
OH,09-18-2019 11:39:41,12346,2.99,USA,USD,2.99,2019-09-18T10:39:41+00:00
OH,09-18-2019 12:39:41,12346,2.99,USA,USD,2.99,2019-09-18T11:39:41+00:00
OH,09-18-2019 13:39:41,12346,2.99,USA,USD,2.99,2019-09-18T12:39:41+00:00
OH,09-18-2019 14:39:41,12346,2.99,USA,USD,2.99,2019-09-18T13:39:41+00:00
OH,09-18-2019 15:39:41,12346,2.99,USA,USD,2.99,2019-09-18T14:39:41+00:00
OH,09-18-2019 16:39:41,12346,2.99,USA,USD,2.99,2019-09-18T15:39:41+00:00
OH,09-18-2019 17:39:41,12346,2.99,USA,USD,2.99,2019-09-18T16:39:41+00:00
OH,09-18-2019 18:39:41,12346,2.99,USA,USD,2.99,2019-09-18T17:39:41+00:00
OH,09-18-2019 19:39:41,12346,2.99,USA,USD,2.99,2019-09-18T18:39:41+00:00
OH,09-18-2019 20:39:41,12345,9.99,USA,USD,9.99,2019-09-18T19:39:41+00:00
OH,09-18-2019 21:39:41,12346,2.99,USA,USD,2.99,2019-09-18T20:39:41+00:00
OH,09-18-2019 22:39:41,12346,2.99,USA,USD,2.99,2019-09-18T21:39:41+00:00
OH,09-18-2019 23:39:41,12345,9.99,USA,USD,9.99,2019-09-18T22:39:41+00:00
OH,09-19-2019 00:39:41,12346,2.99,USA,USD,2.99,2019-09-18T23:39:41+00:00
OH,09-19-2019 01:39:41,12345,9.99,USA,USD,9.99,2019-09-19T00:39:41+00:00
OH,09-19-2019 02:39:41,12346,2.99,USA,USD,2.99,2019-09-19T01:39:41+00:00
OH,09-19-2019 03:39:41,12346,2.99,USA,USD,2.99,2019-09-19T02:39:41+00:00
OH,09-19-2019 04:39:41,12346,2.99,USA,USD,2.99,2019-09-19T03:39:41+00:00
OH,09-19-2019 05:39:41,12346,2.99,USA,USD,2.99,2019-09-19T04:39:41+00:00
OH,09-19-2019 06:39:41,12345,7.99,USA,USD,7.99,2019-09-19T05:39:41+00:00
OH,09-19-2019 07:39:41,12346,2.99,USA,USD,2.99,2019-09-19T06:39:41+00:00
OH,09-19-2019 08:39:41,12345,7.99,USA,USD,7.99,2019-09-19T07:39:41+00:00
OH,09-19-2019 09:39:41,12346,2.99,USA,USD,2.99,2019-09-19T08:39:41+00:00
OH,09-19-2019 10:39:41,12346,2.99,USA,USD,2.99,2019-09-19T09:39:41+00:00
OH,09-19-2019 11:39:41,12346,2.99,USA,USD,2.99,2019-09-19T10:39:41+00:00
OH,09-19-2019 12:39:41,12346,2.99,USA,USD,2.99,2019-09-19T11:39:41+00:00
OH,09-19-2019 13:39:41,12345,9.99,USA,USD,9.99,2019-09-19T12:39:41+00:00
OH,09-19-2019 14:39:41,12346,2.99,USA,USD,2.99,2019-09-19T13:39:41+00:00
OH,09-19-2019 15:39:41,12346,2.99,USA,USD,2.99,2019-09-19T14:39:41+00:00
OH,09-19-2019 16:39:41,12346,2.99,USA,USD,2.99,2019-09-19T15:39:41+00:00
OH,09-19-2019 17:39:41,12346,2.99,USA,USD,2.99,2019-09-19T16:39:41+00:00
OH,09-19-2019 18:39:41,12346,2.99,USA,USD,2.99,2019-09-19T17:39:41+00:00
OH,09-19-2019 19:39:41,12346,2.99,USA,USD,2.99,2019-09-19T18:39:41+00:00
OH,09-19-2019 20:39:41,12345,7.99,USA,USD,7.99,2019-09-19T19:39:41+00:00
OH,09-19-2019 21:39:41,12346,2.99,USA,USD,2.99,2019-09-19T20:39:41+00:00
OH,09-19-2019 22:39:41,12345,9.99,USA,USD,9.99,2019-09-19T21:39:41+00:00
OH,09-19-2019 23:39:41,12346,2.99,USA,USD,2.99,2019-09-19T22:39:41+00:00
OH,09-20-2019 00:39:41,12346,2.99,USA,USD,2.99,2019-09-19T23:39:41+00:00
OH,09-20-2019 01:39:41,12346,2.99,USA,USD,2.99,2019-09-20T00:39:41+00:00
OH,09-20-2019 02:39:41,12346,2.99,USA,USD,2.99,2019-09-20T01:39:41+00:00
OH,09-20-2019 03:39:41,12346,2.99,USA,USD,2.99,2019-09-20T02:39:41+00:00
OH,09-20-2019 04:39:41,12346,2.99,USA,USD,2.99,2019-09-20T03:39:41+00:00
OH,09-20-2019 05:39:41,12345,7.99,USA,USD,7.99,2019-09-20T04:39:41+00:00
OH,09-20-2019 06:39:41,12346,2.99,USA,USD,2.99,2019-09-20T05:39:41+00:00
OH,09-20-2019 07:39:41,12345,7.99,USA,USD,7.99,2019-09-20T06:39:41+00:00
OH,09-20-2019 08:39:41,12346,2.99,USA,USD,2.99,2019-09-20T07:39:41+00:00
OH,09-20-2019 09:39:41,12346,2.99,USA,USD,2.99,2019-09-20T08:39:41+00:00
OH,09-20-2019 10:39:41,12346,2.99,USA,USD,2.99,2019-09-20T09:39:41+00:00
OH,09-20-2019 11:39:41,12345,9.99,USA,USD,9.99,2019-09-20T10:39:41+00:00
OH,09-20-2019 12:39:41,12345,7.99,USA,USD,7.99,2019-09-20T11:39:41+00:00
OH,09-20-2019 13:39:41,12346,2.99,USA,USD,2.99,2019-09-20T12:39:41+00:00
OH,09-20-2019 14:39:41,12346,2.99,USA,USD,2.99,2019-09-20T13:39:41+00:00
OH,09-20-2019 15:39:41,12346,2.99,USA,USD,2.99,2019-09-20T14:39:41+00:00
OH,09-20-2019 16:39:41,12345,7.99,USA,USD,7.99,2019-09-20T15:39:41+00:00
OH,09-20-2019 17:39:41,12346,2.99,USA,USD,2.99,2019-09-20T16:39:41+00:00
OH,09-20-2019 18:39:41,12346,2.99,USA,USD,2.99,2019-09-20T17:39:41+00:00
OH,09-20-2019 19:39:41,12346,2.99,USA,USD,2.99,2019-09-20T18:39:41+00:00
OH,09-20-2019 20:39:41,12346,2.99,USA,USD,2.99,2019-09-20T19:39:41+00:00
OH,09-20-2019 21:39:41,12346,2.99,USA,USD,2.99,2019-09-20T20:39:41+00:00
OH,09-20-2019 22:39:41,12346,2.99,USA,USD,2.99,2019-09-20T21:39:41+00:00
OH,09-20-2019 23:39:41,12346,2.99,USA,USD,2.99,2019-09-20T22:39:41+00:00
OH,09-21-2019 00:39:41,12346,2.99,USA,USD,2.99,2019-09-20T23:39:41+00:00
OH,09-21-2019 01:39:41,12346,2.99,USA,USD,2.99,2019-09-21T00:39:41+00:00
OH,09-21-2019 02:39:41,12346,2.99,USA,USD,2.99,2019-09-21T01:39:41+00:00
OH,09-21-2019 03:39:41,12345,9.99,USA,USD,9.99,2019-09-21T02:39:41+00:00
OH,09-21-2019 04:39:41,12346,2.99,USA,USD,2.99,2019-09-21T03:39:41+00:00
OH,09-21-2019 05:39:41,12345,7.99,USA,USD,7.99,2019-09-21T04:39:41+00:00
OH,09-21-2019 06:39:41,12346,2.99,USA,USD,2.99,2019-09-21T05:39:41+00:00
OH,09-21-2019 07:39:41,12345,7.99,USA,USD,7.99,2019-09-21T06:39:41+00:00
OH,09-21-2019 08:39:41,12346,2.99,USA,USD,2.99,2019-09-21T07:39:41+00:00
OH,09-21-2019 09:39:41,12345,9.99,USA,USD,9.99,2019-09-21T08:39:41+00:00
OH,09-21-2019 10:39:41,12346,2.99,USA,USD,2.99,2019-09-21T09:39:41+00:00
OH,09-21-2019 11:39:41,12346,2.99,USA,USD,2.99,2019-09-21T10:39:41+00:00
OH,09-21-2019 12:39:41,12346,2.99,USA,USD,2.99,2019-09-21T11:39:41+00:00
OH,09-21-2019 13:39:41,12346,2.99,USA,USD,2.99,2019-09-21T12:39:41+00:00
OH,09-21-2019 14:39:41,12346,2.99,USA,USD,2.99,2019-09-21T13:39:41+00:00
OH,09-21-2019 15:39:41,12346,2.99,USA,USD,2.99,2019-09-21T14:39:41+00:00
OH,09-21-2019 16:39:41,12346,2.99,USA,USD,2.99,2019-09-21T15:39:41+00:00
OH,09-21-2019 17:39:41,12345,9.99,USA,USD,9.99,2019-09-21T16:39:41+00:00
OH,09-21-2019 18:39:41,12346,2.99,USA,USD,2.99,2019-09-21T17:39:41+00:00
OH,09-21-2019 19:39:41,12345,7.99,USA,USD,7.99,2019-09-21T18:39:41+00:00
OH,09-21-2019 20:39:41,12346,2.99,USA,USD,2.99,2019-09-21T19:39:41+00:00
OH,09-21-2019 21:39:41,12346,2.99,USA,USD,2.99,2019-09-21T20:39:41+00:00
OH,09-21-2019 22:39:41,12346,2.99,USA,USD,2.99,2019-09-21T21:39:41+00:00
OH,09-21-2019 23:39:41,12346,2.99,USA,USD,2.99,2019-09-21T22:39:41+00:00
OH,09-22-2019 00:39:41,12346,2.99,USA,USD,2.99,2019-09-21T23:39:41+00:00
OH,09-22-2019 01:39:41,12346,2.99,USA,USD,2.99,2019-09-22T00:39:41+00:00
OH,09-22-2019 02:39:41,12345,7.99,USA,USD,7.99,2019-09-22T01:39:41+00:00
OH,09-22-2019 03:39:41,12346,2.99,USA,USD,2.99,2019-09-22T02:39:41+00:00
OH,09-22-2019 04:39:41,12346,2.99,USA,USD,2.99,2019-09-22T03:39:41+00:00
OH,09-22-2019 05:39:41,12346,2.99,USA,USD,2.99,2019-09-22T04:39:41+00:00
OH,09-22-2019 06:39:41,12346,2.99,USA,USD,2.99,2019-09-22T05:39:41+00:00
OH,09-22-2019 07:39:41,12346,2.99,USA,USD,2.99,2019-09-22T06:39:41+00:00
OH,09-22-2019 08:39:41,12346,2.99,USA,USD,2.99,2019-09-22T07:39:41+00:00
OH,09-22-2019 09:39:41,12346,2.99,USA,USD,2.99,2019-09-22T08:39:41+00:00
OH,09-22-2019 10:39:41,12346,2.99,USA,USD,2.99,2019-09-22T09:39:41+00:00
OH,09-22-2019 11:39:41,12345,9.99,USA,USD,9.99,2019-09-22T10:39:41+00:00
OH,09-22-2019 12:39:41,12346,2.99,USA,USD,2.99,2019-09-22T11:39:41+00:00
OH,09-22-2019 13:39:41,12346,2.99,USA,USD,2.99,2019-09-22T12:39:41+00:00
OH,09-22-2019 14:39:41,12346,2.99,USA,USD,2.99,2019-09-22T13:39:41+00:00
OH,09-22-2019 15:39:41,12346,2.99,USA,USD,2.99,2019-09-22T14:39:41+00:00
OH,09-22-2019 16:39:41,12346,2.99,USA,USD,2.99,2019-09-22T15:39:41+00:00
OH,09-22-2019 17:39:41,12346,2.99,USA,USD,2.99,2019-09-22T16:39:41+00:00
OH,09-22-2019 18:39:41,12346,2.99,USA,USD,2.99,2019-09-22T17:39:41+00:00
OH,09-22-2019 19:39:41,12345,7.99,USA,USD,7.99,2019-09-22T18:39:41+00:00
OH,09-22-2019 20:39:41,12345,9.99,USA,USD,9.99,2019-09-22T19:39:41+00:00
OH,09-22-2019 21:39:41,12345,7.99,USA,USD,7.99,2019-09-22T20:39:41+00:00
OH,09-22-2019 22:39:41,12346,2.99,USA,USD,2.99,2019-09-22T21:39:41+00:00
OH,09-22-2019 23:39:41,12346,2.99,USA,USD,2.99,2019-09-22T22:39:41+00:00
OH,09-23-2019 00:39:41,12345,9.99,USA,USD,9.99,2019-09-22T23:39:41+00:00
OH,09-23-2019 01:39:41,12346,2.99,USA,USD,2.99,2019-09-23T00:39:41+00:00
OH,09-23-2019 02:39:41,12346,2.99,USA,USD,2.99,2019-09-23T01:39:41+00:00
OH,09-23-2019 03:39:41,12346,2.99,USA,USD,2.99,2019-09-23T02:39:41+00:00
OH,09-23-2019 04:39:41,12345,7.99,USA,USD,7.99,2019-09-23T03:39:41+00:00
OH,09-23-2019 05:39:41,12346,2.99,USA,USD,2.99,2019-09-23T04:39:41+00:00
OH,09-23-2019 06:39:41,12345,7.99,USA,USD,7.99,2019-09-23T05:39:41+00:00
OH,09-23-2019 07:39:41,12346,2.99,USA,USD,2.99,2019-09-23T06:39:41+00:00
OH,09-23-2019 08:39:41,12345,7.99,USA,USD,7.99,2019-09-23T07:39:41+00:00
OH,09-23-2019 09:39:41,12346,2.99,USA,USD,2.99,2019-09-23T08:39:41+00:00
OH,09-23-2019 10:39:41,12346,2.99,USA,USD,2.99,2019-09-23T09:39:41+00:00
OH,09-23-2019 11:39:41,12346,2.99,USA,USD,2.99,2019-09-23T10:39:41+00:00
OH,09-23-2019 12:39:41,12346,2.99,USA,USD,2.99,2019-09-23T11:39:41+00:00
OH,09-23-2019 13:39:41,12346,2.99,USA,USD,2.99,2019-09-23T12:39:41+00:00
OH,09-23-2019 14:39:41,12346,2.99,USA,USD,2.99,2019-09-23T13:39:41+00:00
OH,09-23-2019 15:39:41,12346,2.99,USA,USD,2.99,2019-09-23T14:39:41+00:00
OH,09-23-2019 16:39:41,12346,2.99,USA,USD,2.99,2019-09-23T15:39:41+00:00
OH,09-23-2019 17:39:41,12346,2.99,USA,USD,2.99,2019-09-23T16:39:41+00:00
OH,09-23-2019 18:39:41,12345,9.99,USA,USD,9.99,2019-09-23T17:39:41+00:00
OH,09-23-2019 19:39:41,12346,2.99,USA,USD,2.99,2019-09-23T18:39:41+00:00
OH,09-23-2019 20:39:41,12346,2.99,USA,USD,2.99,2019-09-23T19:39:41+00:00
OH,09-23-2019 21:39:41,12346,2.99,USA,USD,2.99,2019-09-23T20:39:41+00:00
OH,09-23-2019 22:39:41,12345,7.99,USA,USD,7.99,2019-09-23T21:39:41+00:00
OH,09-23-2019 23:39:41,12346,2.99,USA,USD,2.99,2019-09-23T22:39:41+00:00
OH,09-24-2019 00:39:41,12346,2.99,USA,USD,2.99,2019-09-23T23:39:41+00:00
OH,09-24-2019 01:39:41,12346,2.99,USA,USD,2.99,2019-09-24T00:39:41+00:00
OH,09-24-2019 02:39:41,12346,2.99,USA,USD,2.99,2019-09-24T01:39:41+00:00
OH,09-24-2019 03:39:41,12346,2.99,USA,USD,2.99,2019-09-24T02:39:41+00:00
OH,09-24-2019 04:39:41,12345,7.99,USA,USD,7.99,2019-09-24T03:39:41+00:00
OH,09-24-2019 05:39:41,12345,9.99,USA,USD,9.99,2019-09-24T04:39:41+00:00
OH,09-24-2019 06:39:41,12346,2.99,USA,USD,2.99,2019-09-24T05:39:41+00:00
OH,09-24-2019 07:39:41,12346,2.99,USA,USD,2.99,2019-09-24T06:39:41+00:00
OH,09-24-2019 08:39:41,12346,2.99,USA,USD,2.99,2019-09-24T07:39:41+00:00
OH,09-24-2019 09:39:41,12345,9.99,USA,USD,9.99,2019-09-24T08:39:41+00:00
OH,09-24-2019 10:39:41,12345,9.99,USA,USD,9.99,2019-09-24T09:39:41+00:00
OH,09-24-2019 11:39:41,12346,2.99,USA,USD,2.99,2019-09-24T10:39:41+00:00
OH,09-24-2019 12:39:41,12346,2.99,USA,USD,2.99,2019-09-24T11:39:41+00:00
OH,09-24-2019 13:39:41,12346,2.99,USA,USD,2.99,2019-09-24T12:39:41+00:00
OH,09-24-2019 14:39:41,12346,2.99,USA,USD,2.99,2019-09-24T13:39:41+00:00
OH,09-24-2019 15:39:41,12346,2.99,USA,USD,2.99,2019-09-24T14:39:41+00:00
OH,09-24-2019 16:39:41,12346,2.99,USA,USD,2.99,2019-09-24T15:39:41+00:00
OH,09-24-2019 17:39:41,12345,7.99,USA,USD,7.99,2019-09-24T16:39:41+00:00
OH,09-24-2019 18:39:41,12345,9.99,USA,USD,9.99,2019-09-24T17:39:41+00:00
OH,09-24-2019 19:39:41,12346,2.99,USA,USD,2.99,2019-09-24T18:39:41+00:00
OH,09-24-2019 20:39:41,12346,2.99,USA,USD,2.99,2019-09-24T19:39:41+00:00
OH,09-24-2019 21:39:41,12346,2.99,USA,USD,2.99,2019-09-24T20:39:41+00:00
OH,09-24-2019 22:39:41,12346,2.99,USA,USD,2.99,2019-09-24T21:39:41+00:00
OH,09-24-2019 23:39:41,12346,2.99,USA,USD,2.99,2019-09-24T22:39:41+00:00
OH,09-25-2019 00:39:41,12346,2.99,USA,USD,2.99,2019-09-24T23:39:41+00:00
OH,09-25-2019 01:39:41,12345,7.99,USA,USD,7.99,2019-09-25T00:39:41+00:00
OH,09-25-2019 02:39:41,12346,2.99,USA,USD,2.99,2019-09-25T01:39:41+00:00
OH,09-25-2019 03:39:41,12346,2.99,USA,USD,2.99,2019-09-25T02:39:41+00:00
OH,09-25-2019 04:39:41,12346,2.99,USA,USD,2.99,2019-09-25T03:39:41+00:00
OH,09-25-2019 05:39:41,12346,2.99,USA,USD,2.99,2019-09-25T04:39:41+00:00
OH,09-25-2019 06:39:41,12346,2.99,USA,USD,2.99,2019-09-25T05:39:41+00:00
OH,09-25-2019 07:39:41,12346,2.99,USA,USD,2.99,2019-09-25T06:39:41+00:00
OH,09-25-2019 08:39:41,12345,7.99,USA,USD,7.99,2019-09-25T07:39:41+00:00
OH,09-25-2019 09:39:41,12346,2.99,USA,USD,2.99,2019-09-25T08:39:41+00:00
OH,09-25-2019 10:39:41,12346,2.99,USA,USD,2.99,2019-09-25T09:39:41+00:00
OH,09-25-2019 11:39:41,12346,2.99,USA,USD,2.99,2019-09-25T10:39:41+00:00
OH,09-25-2019 12:39:41,12346,2.99,USA,USD,2.99,2019-09-25T11:39:41+00:00
OH,09-25-2019 13:39:41,12346,2.99,USA,USD,2.99,2019-09-25T12:39:41+00:00
OH,09-25-2019 14:39:41,12346,2.99,USA,USD,2.99,2019-09-25T13:39:41+00:00
OH,09-25-2019 15:39:41,12346,2.99,USA,USD,2.99,2019-09-25T14:39:41+00:00
OH,09-25-2019 16:39:41,12346,2.99,USA,USD,2.99,2019-09-25T15:39:41+00:00
OH,09-25-2019 17:39:41,12346,2.99,USA,USD,2.99,2019-09-25T16:39:41+00:00
OH,09-25-2019 18:39:41,12346,2.99,USA,USD,2.99,2019-09-25T17:39:41+00:00
OH,09-25-2019 19:39:41,12346,2.99,USA,USD,2.99,2019-09-25T18:39:41+00:00
OH,09-25-2019 20:39:41,12346,2.99,USA,USD,2.99,2019-09-25T19:39:41+00:00
OH,09-25-2019 21:39:41,12346,2.99,USA,USD,2.99,2019-09-25T20:39:41+00:00
OH,09-25-2019 22:39:41,12345,9.99,USA,USD,9.99,2019-09-25T21:39:41+00:00
OH,09-25-2019 23:39:41,12345,7.99,USA,USD,7.99,2019-09-25T22:39:41+00:00
OH,09-26-2019 00:39:41,12345,9.99,USA,USD,9.99,2019-09-25T23:39:41+00:00
OH,09-26-2019 01:39:41,12345,9.99,USA,USD,9.99,2019-09-26T00:39:41+00:00
OH,09-26-2019 02:39:41,12345,9.99,USA,USD,9.99,2019-09-26T01:39:41+00:00
OH,09-26-2019 03:39:41,12345,9.99,USA,USD,9.99,2019-09-26T02:39:41+00:00
OH,09-26-2019 04:39:41,12346,2.99,USA,USD,2.99,2019-09-26T03:39:41+00:00
OH,09-26-2019 05:39:41,12346,2.99,USA,USD,2.99,2019-09-26T04:39:41+00:00
OH,09-26-2019 06:39:41,12346,2.99,USA,USD,2.99,2019-09-26T05:39:41+00:00
OH,09-26-2019 07:39:41,12345,7.99,USA,USD,7.99,2019-09-26T06:39:41+00:00
OH,09-26-2019 08:39:41,12346,2.99,USA,USD,2.99,2019-09-26T07:39:41+00:00
OH,09-26-2019 09:39:41,12346,2.99,USA,USD,2.99,2019-09-26T08:39:41+00:00
OH,09-26-2019 10:39:41,12346,2.99,USA,USD,2.99,2019-09-26T09:39:41+00:00
OH,09-26-2019 11:39:41,12345,9.99,USA,USD,9.99,2019-09-26T10:39:41+00:00
OH,09-26-2019 12:39:41,12345,9.99,USA,USD,9.99,2019-09-26T11:39:41+00:00
OH,09-26-2019 13:39:41,12346,2.99,USA,USD,2.99,2019-09-26T12:39:41+00:00
OH,09-26-2019 14:39:41,12346,2.99,USA,USD,2.99,2019-09-26T13:39:41+00:00
OH,09-26-2019 15:39:41,12345,9.99,USA,USD,9.99,2019-09-26T14:39:41+00:00
OH,09-26-2019 16:39:41,12346,2.99,USA,USD,2.99,2019-09-26T15:39:41+00:00
OH,09-26-2019 17:39:41,12346,2.99,USA,USD,2.99,2019-09-26T16:39:41+00:00
OH,09-26-2019 18:39:41,12345,7.99,USA,USD,7.99,2019-09-26T17:39:41+00:00
OH,09-26-2019 19:39:41,12346,2.99,USA,USD,2.99,2019-09-26T18:39:41+00:00
OH,09-26-2019 20:39:41,12346,2.99,USA,USD,2.99,2019-09-26T19:39:41+00:00
OH,09-26-2019 21:39:41,12345,9.99,USA,USD,9.99,2019-09-26T20:39:41+00:00
OH,09-26-2019 22:39:41,12346,2.99,USA,USD,2.99,2019-09-26T21:39:41+00:00
OH,09-26-2019 23:39:41,12346,2.99,USA,USD,2.99,2019-09-26T22:39:41+00:00
OH,09-27-2019 00:39:41,12346,2.99,USA,USD,2.99,2019-09-26T23:39:41+00:00
OH,09-27-2019 01:39:41,12345,9.99,USA,USD,9.99,2019-09-27T00:39:41+00:00
OH,09-27-2019 02:39:41,12345,7.99,USA,USD,7.99,2019-09-27T01:39:41+00:00
OH,09-27-2019 03:39:41,12345,9.99,USA,USD,9.99,2019-09-27T02:39:41+00:00
OH,09-27-2019 04:39:41,12346,2.99,USA,USD,2.99,2019-09-27T03:39:41+00:00
OH,09-27-2019 05:39:41,12346,2.99,USA,USD,2.99,2019-09-27T04:39:41+00:00
OH,09-27-2019 06:39:41,12345,9.99,USA,USD,9.99,2019-09-27T05:39:41+00:00
OH,09-27-2019 07:39:41,12346,2.99,USA,USD,2.99,2019-09-27T06:39:41+00:00
OH,09-27-2019 08:39:41,12346,2.99,USA,USD,2.99,2019-09-27T07:39:41+00:00
OH,09-27-2019 09:39:41,12346,2.99,USA,USD,2.99,2019-09-27T08:39:41+00:00
OH,09-27-2019 10:39:41,12346,2.99,USA,USD,2.99,2019-09-27T09:39:41+00:00
OH,09-27-2019 11:39:41,12346,2.99,USA,USD,2.99,2019-09-27T10:39:41+00:00
OH,09-27-2019 12:39:41,12346,2.99,USA,USD,2.99,2019-09-27T11:39:41+00:00
OH,09-27-2019 13:39:41,12346,2.99,USA,USD,2.99,2019-09-27T12:39:41+00:00
OH,09-27-2019 14:39:41,12346,2.99,USA,USD,2.99,2019-09-27T13:39:41+00:00
OH,09-27-2019 15:39:41,12345,7.99,USA,USD,7.99,2019-09-27T14:39:41+00:00
OH,09-27-2019 16:39:41,12346,2.99,USA,USD,2.99,2019-09-27T15:39:41+00:00
OH,09-27-2019 17:39:41,12346,2.99,USA,USD,2.99,2019-09-27T16:39:41+00:00
OH,09-27-2019 18:39:41,12346,2.99,USA,USD,2.99,2019-09-27T17:39:41+00:00
OH,09-27-2019 19:39:41,12346,2.99,USA,USD,2.99,2019-09-27T18:39:41+00:00
OH,09-27-2019 20:39:41,12346,2.99,USA,USD,2.99,2019-09-27T19:39:41+00:00
OH,09-27-2019 21:39:41,12346,2.99,USA,USD,2.99,2019-09-27T20:39:41+00:00
OH,09-27-2019 22:39:41,12346,2.99,USA,USD,2.99,2019-09-27T21:39:41+00:00
OH,09-27-2019 23:39:41,12346,2.99,USA,USD,2.99,2019-09-27T22:39:41+00:00
OH,09-28-2019 00:39:41,12345,7.99,USA,USD,7.99,2019-09-27T23:39:41+00:00
OH,09-28-2019 01:39:41,12346,2.99,USA,USD,2.99,2019-09-28T00:39:41+00:00
OH,09-28-2019 02:39:41,12346,2.99,USA,USD,2.99,2019-09-28T01:39:41+00:00
OH,09-28-2019 03:39:41,12345,7.99,USA,USD,7.99,2019-09-28T02:39:41+00:00
OH,09-28-2019 04:39:41,12345,7.99,USA,USD,7.99,2019-09-28T03:39:41+00:00
OH,09-28-2019 05:39:41,12346,2.99,USA,USD,2.99,2019-09-28T04:39:41+00:00
OH,09-28-2019 06:39:41,12346,2.99,USA,USD,2.99,2019-09-28T05:39:41+00:00
OH,09-28-2019 07:39:41,12346,2.99,USA,USD,2.99,2019-09-28T06:39:41+00:00
OH,09-28-2019 08:39:41,12346,2.99,USA,USD,2.99,2019-09-28T07:39:41+00:00
OH,09-28-2019 09:39:41,12346,2.99,USA,USD,2.99,2019-09-28T08:39:41+00:00
OH,09-28-2019 10:39:41,12346,2.99,USA,USD,2.99,2019-09-28T09:39:41+00:00
OH,09-28-2019 11:39:41,12346,2.99,USA,USD,2.99,2019-09-28T10:39:41+00:00
OH,09-28-2019 12:39:41,12346,2.99,USA,USD,2.99,2019-09-28T11:39:41+00:00
OH,09-28-2019 13:39:41,12346,2.99,USA,USD,2.99,2019-09-28T12:39:41+00:00
OH,09-28-2019 14:39:41,12345,7.99,USA,USD,7.99,2019-09-28T13:39:41+00:00
OH,09-28-2019 15:39:41,12346,2.99,USA,USD,2.99,2019-09-28T14:39:41+00:00
OH,09-28-2019 16:39:41,12346,2.99,USA,USD,2.99,2019-09-28T15:39:41+00:00
OH,09-28-2019 17:39:41,12345,7.99,USA,USD,7.99,2019-09-28T16:39:41+00:00
OH,09-28-2019 18:39:41,12346,2.99,USA,USD,2.99,2019-09-28T17:39:41+00:00
OH,09-28-2019 19:39:41,12345,7.99,USA,USD,7.99,2019-09-28T18:39:41+00:00
OH,09-28-2019 20:39:41,12346,2.99,USA,USD,2.99,2019-09-28T19:39:41+00:00
OH,09-28-2019 21:39:41,12346,2.99,USA,USD,2.99,2019-09-28T20:39:41+00:00
OH,09-28-2019 22:39:41,12346,2.99,USA,USD,2.99,2019-09-28T21:39:41+00:00
OH,09-28-2019 23:39:41,12346,2.99,USA,USD,2.99,2019-09-28T22:39:41+00:00
OH,09-29-2019 00:39:41,12345,9.99,USA,USD,9.99,2019-09-28T23:39:41+00:00
OH,09-29-2019 01:39:41,12346,2.99,USA,USD,2.99,2019-09-29T00:39:41+00:00
OH,09-29-2019 02:39:41,12346,2.99,USA,USD,2.99,2019-09-29T01:39:41+00:00
OH,09-29-2019 03:39:41,12345,7.99,USA,USD,7.99,2019-09-29T02:39:41+00:00
OH,09-29-2019 04:39:41,12345,7.99,USA,USD,7.99,2019-09-29T03:39:41+00:00
OH,09-29-2019 05:39:41,12346,2.99,USA,USD,2.99,2019-09-29T04:39:41+00:00
OH,09-29-2019 06:39:41,12345,9.99,USA,USD,9.99,2019-09-29T05:39:41+00:00
OH,09-29-2019 07:39:41,12346,2.99,USA,USD,2.99,2019-09-29T06:39:41+00:00
OH,09-29-2019 08:39:41,12346,2.99,USA,USD,2.99,2019-09-29T07:39:41+00:00
OH,09-29-2019 09:39:41,12346,2.99,USA,USD,2.99,2019-09-29T08:39:41+00:00
OH,09-29-2019 10:39:41,12346,2.99,USA,USD,2.99,2019-09-29T09:39:41+00:00
OH,09-29-2019 11:39:41,12346,2.99,USA,USD,2.99,2019-09-29T10:39:41+00:00
OH,09-29-2019 12:39:41,12345,9.99,USA,USD,9.99,2019-09-29T11:39:41+00:00
OH,09-29-2019 13:39:41,12346,2.99,USA,USD,2.99,2019-09-29T12:39:41+00:00
OH,09-29-2019 14:39:41,12345,9.99,USA,USD,9.99,2019-09-29T13:39:41+00:00
OH,09-29-2019 15:39:41,12346,2.99,USA,USD,2.99,2019-09-29T14:39:41+00:00
OH,09-29-2019 16:39:41,12345,9.99,USA,USD,9.99,2019-09-29T15:39:41+00:00
OH,09-29-2019 17:39:41,12346,2.99,USA,USD,2.99,2019-09-29T16:39:41+00:00
OH,09-29-2019 18:39:41,12345,7.99,USA,USD,7.99,2019-09-29T17:39:41+00:00
OH,09-29-2019 19:39:41,12346,2.99,USA,USD,2.99,2019-09-29T18:39:41+00:00
OH,09-29-2019 20:39:41,12346,2.99,USA,USD,2.99,2019-09-29T19:39:41+00:00
OH,09-29-2019 21:39:41,12346,2.99,USA,USD,2.99,2019-09-29T20:39:41+00:00
OH,09-29-2019 22:39:41,12346,2.99,USA,USD,2.99,2019-09-29T21:39:41+00:00
OH,09-29-2019 23:39:41,12345,9.99,USA,USD,9.99,2019-09-29T22:39:41+00:00
OH,09-30-2019 00:39:41,12345,9.99,USA,USD,9.99,2019-09-29T23:39:41+00:00
OH,09-30-2019 01:39:41,12346,2.99,USA,USD,2.99,2019-09-30T00:39:41+00:00
OH,09-30-2019 02:39:41,12346,2.99,USA,USD,2.99,2019-09-30T01:39:41+00:00
OH,09-30-2019 03:39:41,12346,2.99,USA,USD,2.99,2019-09-30T02:39:41+00:00
OH,09-30-2019 04:39:41,12345,9.99,USA,USD,9.99,2019-09-30T03:39:41+00:00
OH,09-30-2019 05:39:41,12346,2.99,USA,USD,2.99,2019-09-30T04:39:41+00:00
OH,09-30-2019 06:39:41,12346,2.99,USA,USD,2.99,2019-09-30T05:39:41+00:00
OH,09-30-2019 07:39:41,12346,2.99,USA,USD,2.99,2019-09-30T06:39:41+00:00
OH,09-30-2019 08:39:41,12346,2.99,USA,USD,2.99,2019-09-30T07:39:41+00:00
OH,09-30-2019 09:39:41,12345,7.99,USA,USD,7.99,2019-09-30T08:39:41+00:00
OH,09-30-2019 10:39:41,12346,2.99,USA,USD,2.99,2019-09-30T09:39:41+00:00
OH,09-30-2019 11:39:41,12346,2.99,USA,USD,2.99,2019-09-30T10:39:41+00:00
OH,09-30-2019 12:39:41,12346,2.99,USA,USD,2.99,2019-09-30T11:39:41+00:00
OH,09-30-2019 13:39:41,12345,9.99,USA,USD,9.99,2019-09-30T12:39:41+00:00
OH,09-30-2019 14:39:41,12346,2.99,USA,USD,2.99,2019-09-30T13:39:41+00:00
OH,09-30-2019 15:39:41,12345,7.99,USA,USD,7.99,2019-09-30T14:39:41+00:00
OH,09-30-2019 16:39:41,12346,2.99,USA,USD,2.99,2019-09-30T15:39:41+00:00
OH,09-30-2019 17:39:41,12346,2.99,USA,USD,2.99,2019-09-30T16:39:41+00:00
OH,09-30-2019 18:39:41,12345,9.99,USA,USD,9.99,2019-09-30T17:39:41+00:00
OH,09-30-2019 19:39:41,12346,2.99,USA,USD,2.99,2019-09-30T18:39:41+00:00
OH,09-30-2019 20:39:41,12346,2.99,USA,USD,2.99,2019-09-30T19:39:41+00:00
OH,09-30-2019 21:39:41,12345,7.99,USA,USD,7.99,2019-09-30T20:39:41+00:00
OH,09-30-2019 22:39:41,12345,7.99,USA,USD,7.99,2019-09-30T21:39:41+00:00
OH,09-30-2019 23:39:41,12345,7.99,USA,USD,7.99,2019-09-30T22:39:41+00:00
OH,10-01-2019 00:39:41,12346,2.99,USA,USD,2.99,2019-09-30T23:39:41+00:00
OH,10-01-2019 01:39:41,12346,2.99,USA,USD,2.99,2019-10-01T00:39:41+00:00
OH,10-01-2019 02:39:41,12345,7.99,USA,USD,7.99,2019-10-01T01:39:41+00:00
OH,10-01-2019 03:39:41,12345,9.99,USA,USD,9.99,2019-10-01T02:39:41+00:00
OH,10-01-2019 04:39:41,12346,2.99,USA,USD,2.99,2019-10-01T03:39:41+00:00
OH,10-01-2019 05:39:41,12345,7.99,USA,USD,7.99,2019-10-01T04:39:41+00:00
OH,10-01-2019 06:39:41,12346,2.99,USA,USD,2.99,2019-10-01T05:39:41+00:00
OH,10-01-2019 07:39:41,12346,2.99,USA,USD,2.99,2019-10-01T06:39:41+00:00
OH,10-01-2019 08:39:41,12346,2.99,USA,USD,2.99,2019-10-01T07:39:41+00:00
OH,10-01-2019 09:39:41,12345,9.99,USA,USD,9.99,2019-10-01T08:39:41+00:00
OH,10-01-2019 10:39:41,12346,2.99,USA,USD,2.99,2019-10-01T09:39:41+00:00
OH,10-01-2019 11:39:41,12345,9.99,USA,USD,9.99,2019-10-01T10:39:41+00:00
OH,10-01-2019 12:39:41,12346,2.99,USA,USD,2.99,2019-10-01T11:39:41+00:00
OH,10-01-2019 13:39:41,12346,2.99,USA,USD,2.99,2019-10-01T12:39:41+00:00
OH,10-01-2019 14:39:41,12345,9.99,USA,USD,9.99,2019-10-01T13:39:41+00:00
OH,10-01-2019 15:39:41,12345,9.99,USA,USD,9.99,2019-10-01T14:39:41+00:00
OH,10-01-2019 16:39:41,12346,2.99,USA,USD,2.99,2019-10-01T15:39:41+00:00
OH,10-01-2019 17:39:41,12346,2.99,USA,USD,2.99,2019-10-01T16:39:41+00:00
OH,10-01-2019 18:39:41,12346,2.99,USA,USD,2.99,2019-10-01T17:39:41+00:00
OH,10-01-2019 19:39:41,12345,7.99,USA,USD,7.99,2019-10-01T18:39:41+00:00
OH,10-01-2019 20:39:41,12345,9.99,USA,USD,9.99,2019-10-01T19:39:41+00:00
OH,10-01-2019 21:39:41,12345,7.99,USA,USD,7.99,2019-10-01T20:39:41+00:00
OH,10-01-2019 22:39:41,12346,2.99,USA,USD,2.99,2019-10-01T21:39:41+00:00
OH,10-01-2019 23:39:41,12346,2.99,USA,USD,2.99,2019-10-01T22:39:41+00:00
OH,10-02-2019 00:39:41,12346,2.99,USA,USD,2.99,2019-10-01T23:39:41+00:00
OH,10-02-2019 01:39:41,12346,2.99,USA,USD,2.99,2019-10-02T00:39:41+00:00
OH,10-02-2019 02:39:41,12346,2.99,USA,USD,2.99,2019-10-02T01:39:41+00:00
OH,10-02-2019 03:39:41,12346,2.99,USA,USD,2.99,2019-10-02T02:39:41+00:00
OH,10-02-2019 04:39:41,12346,2.99,USA,USD,2.99,2019-10-02T03:39:41+00:00
OH,10-02-2019 05:39:41,12346,2.99,USA,USD,2.99,2019-10-02T04:39:41+00:00
OH,10-02-2019 06:39:41,12346,2.99,USA,USD,2.99,2019-10-02T05:39:41+00:00
OH,10-02-2019 07:39:41,12346,2.99,USA,USD,2.99,2019-10-02T06:39:41+00:00
OH,10-02-2019 08:39:41,12345,9.99,USA,USD,9.99,2019-10-02T07:39:41+00:00
OH,10-02-2019 09:39:41,12346,2.99,USA,USD,2.99,2019-10-02T08:39:41+00:00
OH,10-02-2019 10:39:41,12345,7.99,USA,USD,7.99,2019-10-02T09:39:41+00:00
OH,10-02-2019 11:39:41,12346,2.99,USA,USD,2.99,2019-10-02T10:39:41+00:00
OH,10-02-2019 12:39:41,12346,2.99,USA,USD,2.99,2019-10-02T11:39:41+00:00
OH,10-02-2019 13:39:41,12346,2.99,USA,USD,2.99,2019-10-02T12:39:41+00:00
OH,10-02-2019 14:39:41,12346,2.99,USA,USD,2.99,2019-10-02T13:39:41+00:00
OH,10-02-2019 15:39:41,12346,2.99,USA,USD,2.99,2019-10-02T14:39:41+00:00
OH,10-02-2019 16:39:41,12346,2.99,USA,USD,2.99,2019-10-02T15:39:41+00:00
OH,10-02-2019 17:39:41,12346,2.99,USA,USD,2.99,2019-10-02T16:39:41+00:00
OH,10-02-2019 18:39:41,12346,2.99,USA,USD,2.99,2019-10-02T17:39:41+00:00
OH,10-02-2019 19:39:41,12346,2.99,USA,USD,2.99,2019-10-02T18:39:41+00:00
OH,10-02-2019 20:39:41,12346,2.99,USA,USD,2.99,2019-10-02T19:39:41+00:00
OH,10-02-2019 21:39:41,12345,9.99,USA,USD,9.99,2019-10-02T20:39:41+00:00
OH,10-02-2019 22:39:41,12346,2.99,USA,USD,2.99,2019-10-02T21:39:41+00:00
OH,10-02-2019 23:39:41,12346,2.99,USA,USD,2.99,2019-10-02T22:39:41+00:00
OH,10-03-2019 00:39:41,12346,2.99,USA,USD,2.99,2019-10-02T23:39:41+00:00
OH,10-03-2019 01:39:41,12345,9.99,USA,USD,9.99,2019-10-03T00:39:41+00:00
OH,10-03-2019 02:39:41,12346,2.99,USA,USD,2.99,2019-10-03T01:39:41+00:00
OH,10-03-2019 03:39:41,12345,9.99,USA,USD,9.99,2019-10-03T02:39:41+00:00
OH,10-03-2019 04:39:41,12346,2.99,USA,USD,2.99,2019-10-03T03:39:41+00:00
OH,10-03-2019 05:39:41,12346,2.99,USA,USD,2.99,2019-10-03T04:39:41+00:00
OH,10-03-2019 06:39:41,12346,2.99,USA,USD,2.99,2019-10-03T05:39:41+00:00
OH,10-03-2019 07:39:41,12346,2.99,USA,USD,2.99,2019-10-03T06:39:41+00:00
OH,10-03-2019 08:39:41,12346,2.99,USA,USD,2.99,2019-10-03T07:39:41+00:00
OH,10-03-2019 09:39:41,12346,2.99,USA,USD,2.99,2019-10-03T08:39:41+00:00
OH,10-03-2019 10:39:41,12346,2.99,USA,USD,2.99,2019-10-03T09:39:41+00:00
OH,10-03-2019 11:39:41,12346,2.99,USA,USD,2.99,2019-10-03T10:39:41+00:00
OH,10-03-2019 12:39:41,12345,7.99,USA,USD,7.99,2019-10-03T11:39:41+00:00
OH,10-03-2019 13:39:41,12346,2.99,USA,USD,2.99,2019-10-03T12:39:41+00:00
OH,10-03-2019 14:39:41,12346,2.99,USA,USD,2.99,2019-10-03T13:39:41+00:00
OH,10-03-2019 15:39:41,12345,7.99,USA,USD,7.99,2019-10-03T14:39:41+00:00
OH,10-03-2019 16:39:41,12346,2.99,USA,USD,2.99,2019-10-03T15:39:41+00:00
OH,10-03-2019 17:39:41,12346,2.99,USA,USD,2.99,2019-10-03T16:39:41+00:00
OH,10-03-2019 18:39:41,12346,2.99,USA,USD,2.99,2019-10-03T17:39:41+00:00
OH,10-03-2019 19:39:41,12346,2.99,USA,USD,2.99,2019-10-03T18:39:41+00:00
OH,10-03-2019 20:39:41,12345,7.99,USA,USD,7.99,2019-10-03T19:39:41+00:00
OH,10-03-2019 21:39:41,12346,2.99,USA,USD,2.99,2019-10-03T20:39:41+00:00
OH,10-03-2019 22:39:41,12346,2.99,USA,USD,2.99,2019-10-03T21:39:41+00:00
OH,10-03-2019 23:39:41,12346,2.99,USA,USD,2.99,2019-10-03T22:39:41+00:00
OH,10-04-2019 00:39:41,12346,2.99,USA,USD,2.99,2019-10-03T23:39:41+00:00
OH,10-04-2019 01:39:41,12345,7.99,USA,USD,7.99,2019-10-04T00:39:41+00:00
OH,10-04-2019 02:39:41,12346,2.99,USA,USD,2.99,2019-10-04T01:39:41+00:00
OH,10-04-2019 03:39:41,12345,7.99,USA,USD,7.99,2019-10-04T02:39:41+00:00
OH,10-04-2019 04:39:41,12345,7.99,USA,USD,7.99,2019-10-04T03:39:41+00:00
OH,10-04-2019 05:39:41,12346,2.99,USA,USD,2.99,2019-10-04T04:39:41+00:00
OH,10-04-2019 06:39:41,12346,2.99,USA,USD,2.99,2019-10-04T05:39:41+00:00
OH,10-04-2019 07:39:41,12346,2.99,USA,USD,2.99,2019-10-04T06:39:41+00:00
OH,10-04-2019 08:39:41,12346,2.99,USA,USD,2.99,2019-10-04T07:39:41+00:00
OH,10-04-2019 09:39:41,12345,9.99,USA,USD,9.99,2019-10-04T08:39:41+00:00
OH,10-04-2019 10:39:41,12346,2.99,USA,USD,2.99,2019-10-04T09:39:41+00:00
OH,10-04-2019 11:39:41,12346,2.99,USA,USD,2.99,2019-10-04T10:39:41+00:00
OH,10-04-2019 12:39:41,12345,9.99,USA,USD,9.99,2019-10-04T11:39:41+00:00
OH,10-04-2019 13:39:41,12346,2.99,USA,USD,2.99,2019-10-04T12:39:41+00:00
OH,10-04-2019 14:39:41,12345,9.99,USA,USD,9.99,2019-10-04T13:39:41+00:00
OH,10-04-2019 15:39:41,12346,2.99,USA,USD,2.99,2019-10-04T14:39:41+00:00
OH,10-04-2019 16:39:41,12346,2.99,USA,USD,2.99,2019-10-04T15:39:41+00:00
OH,10-04-2019 17:39:41,12346,2.99,USA,USD,2.99,2019-10-04T16:39:41+00:00
OH,10-04-2019 18:39:41,12345,9.99,USA,USD,9.99,2019-10-04T17:39:41+00:00
OH,10-04-2019 19:39:41,12346,2.99,USA,USD,2.99,2019-10-04T18:39:41+00:00
OH,10-04-2019 20:39:41,12345,9.99,USA,USD,9.99,2019-10-04T19:39:41+00:00
OH,10-04-2019 21:39:41,12345,9.99,USA,USD,9.99,2019-10-04T20:39:41+00:00
OH,10-04-2019 22:39:41,12346,2.99,USA,USD,2.99,2019-10-04T21:39:41+00:00
OH,10-04-2019 23:39:41,12346,2.99,USA,USD,2.99,2019-10-04T22:39:41+00:00
OH,10-05-2019 00:39:41,12345,7.99,USA,USD,7.99,2019-10-04T23:39:41+00:00
OH,10-05-2019 01:39:41,12346,2.99,USA,USD,2.99,2019-10-05T00:39:41+00:00
OH,10-05-2019 02:39:41,12346,2.99,USA,USD,2.99,2019-10-05T01:39:41+00:00
OH,10-05-2019 03:39:41,12346,2.99,USA,USD,2.99,2019-10-05T02:39:41+00:00
OH,10-05-2019 04:39:41,12345,7.99,USA,USD,7.99,2019-10-05T03:39:41+00:00
OH,10-05-2019 05:39:41,12345,9.99,USA,USD,9.99,2019-10-05T04:39:41+00:00
OH,10-05-2019 06:39:41,12345,7.99,USA,USD,7.99,2019-10-05T05:39:41+00:00
OH,10-05-2019 07:39:41,12345,9.99,USA,USD,9.99,2019-10-05T06:39:41+00:00
OH,10-05-2019 08:39:41,12346,2.99,USA,USD,2.99,2019-10-05T07:39:41+00:00
OH,10-05-2019 09:39:41,12346,2.99,USA,USD,2.99,2019-10-05T08:39:41+00:00
OH,10-05-2019 10:39:41,12346,2.99,USA,USD,2.99,2019-10-05T09:39:41+00:00
OH,10-05-2019 11:39:41,12345,9.99,USA,USD,9.99,2019-10-05T10:39:41+00:00
OH,10-05-2019 12:39:41,12345,7.99,USA,USD,7.99,2019-10-05T11:39:41+00:00
OH,10-05-2019 13:39:41,12346,2.99,USA,USD,2.99,2019-10-05T12:39:41+00:00
OH,10-05-2019 14:39:41,12345,9.99,USA,USD,9.99,2019-10-05T13:39:41+00:00
OH,10-05-2019 15:39:41,12346,2.99,USA,USD,2.99,2019-10-05T14:39:41+00:00
OH,10-05-2019 16:39:41,12345,9.99,USA,USD,9.99,2019-10-05T15:39:41+00:00
OH,10-05-2019 17:39:41,12346,2.99,USA,USD,2.99,2019-10-05T16:39:41+00:00
OH,10-05-2019 18:39:41,12346,2.99,USA,USD,2.99,2019-10-05T17:39:41+00:00
OH,10-05-2019 19:39:41,12346,2.99,USA,USD,2.99,2019-10-05T18:39:41+00:00
OH,10-05-2019 20:39:41,12345,9.99,USA,USD,9.99,2019-10-05T19:39:41+00:00
OH,10-05-2019 21:39:41,12345,9.99,USA,USD,9.99,2019-10-05T20:39:41+00:00
OH,10-05-2019 22:39:41,12346,2.99,USA,USD,2.99,2019-10-05T21:39:41+00:00
OH,10-05-2019 23:39:41,12346,2.99,USA,USD,2.99,2019-10-05T22:39:41+00:00
OH,10-06-2019 00:39:41,12345,9.99,USA,USD,9.99,2019-10-05T23:39:41+00:00
OH,10-06-2019 01:39:41,12345,7.99,USA,USD,7.99,2019-10-06T00:39:41+00:00
OH,10-06-2019 02:39:41,12345,7.99,USA,USD,7.99,2019-10-06T01:39:41+00:00
OH,10-06-2019 03:39:41,12346,2.99,USA,USD,2.99,2019-10-06T02:39:41+00:00
OH,10-06-2019 04:39:41,12345,7.99,USA,USD,7.99,2019-10-06T03:39:41+00:00
OH,10-06-2019 05:39:41,12346,2.99,USA,USD,2.99,2019-10-06T04:39:41+00:00
OH,10-06-2019 06:39:41,12345,9.99,USA,USD,9.99,2019-10-06T05:39:41+00:00
OH,10-06-2019 07:39:41,12345,7.99,USA,USD,7.99,2019-10-06T06:39:41+00:00
OH,10-06-2019 08:39:41,12346,2.99,USA,USD,2.99,2019-10-06T07:39:41+00:00
OH,10-06-2019 09:39:41,12346,2.99,USA,USD,2.99,2019-10-06T08:39:41+00:00
OH,10-06-2019 10:39:41,12345,7.99,USA,USD,7.99,2019-10-06T09:39:41+00:00
OH,10-06-2019 11:39:41,12345,9.99,USA,USD,9.99,2019-10-06T10:39:41+00:00
OH,10-06-2019 12:39:41,12346,2.99,USA,USD,2.99,2019-10-06T11:39:41+00:00
OH,10-06-2019 13:39:41,12346,2.99,USA,USD,2.99,2019-10-06T12:39:41+00:00
OH,10-06-2019 14:39:41,12346,2.99,USA,USD,2.99,2019-10-06T13:39:41+00:00
OH,10-06-2019 15:39:41,12345,9.99,USA,USD,9.99,2019-10-06T14:39:41+00:00
OH,10-06-2019 16:39:41,12346,2.99,USA,USD,2.99,2019-10-06T15:39:41+00:00
OH,10-06-2019 17:39:41,12346,2.99,USA,USD,2.99,2019-10-06T16:39:41+00:00
OH,10-06-2019 18:39:41,12346,2.99,USA,USD,2.99,2019-10-06T17:39:41+00:00
OH,10-06-2019 19:39:41,12346,2.99,USA,USD,2.99,2019-10-06T18:39:41+00:00
OH,10-06-2019 20:39:41,12345,9.99,USA,USD,9.99,2019-10-06T19:39:41+00:00
OH,10-06-2019 21:39:41,12345,9.99,USA,USD,9.99,2019-10-06T20:39:41+00:00
OH,10-06-2019 22:39:41,12345,9.99,USA,USD,9.99,2019-10-06T21:39:41+00:00
OH,10-06-2019 23:39:41,12346,2.99,USA,USD,2.99,2019-10-06T22:39:41+00:00
OH,10-07-2019 00:39:41,12346,2.99,USA,USD,2.99,2019-10-06T23:39:41+00:00
OH,10-07-2019 01:39:41,12346,2.99,USA,USD,2.99,2019-10-07T00:39:41+00:00
OH,10-07-2019 02:39:41,12345,7.99,USA,USD,7.99,2019-10-07T01:39:41+00:00
OH,10-07-2019 03:39:41,12345,7.99,USA,USD,7.99,2019-10-07T02:39:41+00:00
OH,10-07-2019 04:39:41,12346,2.99,USA,USD,2.99,2019-10-07T03:39:41+00:00
OH,10-07-2019 05:39:41,12346,2.99,USA,USD,2.99,2019-10-07T04:39:41+00:00
OH,10-07-2019 06:39:41,12346,2.99,USA,USD,2.99,2019-10-07T05:39:41+00:00
OH,10-07-2019 07:39:41,12345,9.99,USA,USD,9.99,2019-10-07T06:39:41+00:00
OH,10-07-2019 08:39:41,12345,7.99,USA,USD,7.99,2019-10-07T07:39:41+00:00
OH,10-07-2019 09:39:41,12346,2.99,USA,USD,2.99,2019-10-07T08:39:41+00:00
OH,10-07-2019 10:39:41,12346,2.99,USA,USD,2.99,2019-10-07T09:39:41+00:00
OH,10-07-2019 11:39:41,12346,2.99,USA,USD,2.99,2019-10-07T10:39:41+00:00
OH,10-07-2019 12:39:41,12346,2.99,USA,USD,2.99,2019-10-07T11:39:41+00:00
OH,10-07-2019 13:39:41,12345,9.99,USA,USD,9.99,2019-10-07T12:39:41+00:00
OH,10-07-2019 14:39:41,12346,2.99,USA,USD,2.99,2019-10-07T13:39:41+00:00
OH,10-07-2019 15:39:41,12345,7.99,USA,USD,7.99,2019-10-07T14:39:41+00:00
OH,10-07-2019 16:39:41,12346,2.99,USA,USD,2.99,2019-10-07T15:39:41+00:00
OH,10-07-2019 17:39:41,12345,7.99,USA,USD,7.99,2019-10-07T16:39:41+00:00
OH,10-07-2019 18:39:41,12346,2.99,USA,USD,2.99,2019-10-07T17:39:41+00:00
OH,10-07-2019 19:39:41,12346,2.99,USA,USD,2.99,2019-10-07T18:39:41+00:00
OH,10-07-2019 20:39:41,12346,2.99,USA,USD,2.99,2019-10-07T19:39:41+00:00
OH,10-07-2019 21:39:41,12346,2.99,USA,USD,2.99,2019-10-07T20:39:41+00:00
OH,10-07-2019 22:39:41,12346,2.99,USA,USD,2.99,2019-10-07T21:39:41+00:00
OH,10-07-2019 23:39:41,12346,2.99,USA,USD,2.99,2019-10-07T22:39:41+00:00
OH,10-08-2019 00:39:41,12345,7.99,USA,USD,7.99,2019-10-07T23:39:41+00:00
OH,10-08-2019 01:39:41,12345,7.99,USA,USD,7.99,2019-10-08T00:39:41+00:00
OH,10-08-2019 02:39:41,12346,2.99,USA,USD,2.99,2019-10-08T01:39:41+00:00
OH,10-08-2019 03:39:41,12346,2.99,USA,USD,2.99,2019-10-08T02:39:41+00:00
OH,10-08-2019 04:39:41,12345,9.99,USA,USD,9.99,2019-10-08T03:39:41+00:00
OH,10-08-2019 05:39:41,12346,2.99,USA,USD,2.99,2019-10-08T04:39:41+00:00
OH,10-08-2019 06:39:41,12345,9.99,USA,USD,9.99,2019-10-08T05:39:41+00:00
OH,10-08-2019 07:39:41,12346,2.99,USA,USD,2.99,2019-10-08T06:39:41+00:00
OH,10-08-2019 08:39:41,12346,2.99,USA,USD,2.99,2019-10-08T07:39:41+00:00
OH,10-08-2019 09:39:41,12346,2.99,USA,USD,2.99,2019-10-08T08:39:41+00:00
